"type","Rank_metric","Drug_set","ES","NES","p_value","Position_at_max","FDR_q_value","Leading_edge","minusLogP","minusLogFDR","sig"
"HCC827","Pearson.est","EGFR inhibitor",-0.87589,-2.19,0,1339,0.00899,"brigatinib, GW.583340, BIBX.1382, CUDC.101, PD.153035, rociletinib, WZ8040, icotinib, AEE788, TAK.285, BIBU.1361, CP.724714, gefitinib, WZ.4002, ARRY.334543, AST.1306, BMS.599626, tucatinib, vandetanib, PD.168393, XL.647, erlotinib, neratinib, lapatinib, BMS.690514, dacomitinib, AZD8931, osimertinib, poziotinib, canertinib, pelitinib, afatinib",Inf,2.04624030826677,TRUE
"HCC827","Pearson.est","Abl kinase inhibitor",-0.53942,-1.35,0.172,1415,0.436,"dasatinib, bosutinib, ZM.306416",0.764471553092451,0.360513510731414,FALSE
"HCC827","Pearson.est","acetylcholine receptor agonist",0.35021,0.857,0.63,434,0.894,"tremorine, nicotine, nefiracetam",0.200659450546418,0.0486624812040823,FALSE
"HCC827","Pearson.est","acetylcholine receptor antagonist",0.65991,1.57,0.0344,444,0.36,"dicycloverine, methscopolamine, iododexetimide, darifenacin, diphemanil",1.46344155742847,0.443697499232713,FALSE
"HCC827","Pearson.est","adenosine receptor antagonist",-0.50206,-1.25,0.224,1354,0.514,"MRS.1220, CGS.15943",0.649751981665837,0.289036881004724,FALSE
"HCC827","Pearson.est","adrenergic receptor agonist",-0.33107,-0.828,0.649,1133,0.965,"epinephrine, midodrine, metaraminol, isoxsuprine",0.187755303199631,0.0154726866562074,FALSE
"HCC827","Pearson.est","adrenergic receptor antagonist",0.2948,0.737,0.797,406,0.947,"metoprolol, atenolol......, levobunolol, carvedilol, idazoxan, oxprenolol, atenolol....",0.0985416786038876,0.0236500209967266,FALSE
"HCC827","Pearson.est","AKT inhibitor",-0.53725,-1.32,0.183,1070,0.446,"palomid.529, GSK2110183, AZD5363, A.674563, CCT128930, GDC.0068, uprosertib, triciribine",0.737548910269571,0.350665141287858,FALSE
"HCC827","Pearson.est","ALK tyrosine kinase receptor inhibitor",-0.61832,-1.53,0.071,1280,0.326,"NVP.TAE684, CEP.37440, brigatinib, GW.788388, AP26113, AZD3463",1.14874165128092,0.486782399932061,FALSE
"HCC827","Pearson.est","androgen receptor antagonist",0.44791,1.1,0.342,553,0.757,"nilutamide, flutamide, bicalutamide",0.465973893943865,0.120904120499927,FALSE
"HCC827","Pearson.est","antioxidant",0.44847,1.11,0.328,496,0.768,"taurine, chlorogenic.acid",0.484126156288321,0.114638779968488,FALSE
"HCC827","Pearson.est","AP inhibitor",0.48078,1.16,0.287,351,0.694,"idronoxil, GDC.0152, LCL.161, birinapant",0.542118103266008,0.158640529545145,FALSE
"HCC827","Pearson.est","ATPase inhibitor",0.62145,1.54,0.058,417,0.336,"digoxin, oligomycin.a, digitoxigenin, digitoxin, blebbistatin...., evodiamine, ouabain, NMS.873",1.23657200643706,0.473660722610156,FALSE
"HCC827","Pearson.est","Aurora kinase inhibitor",0.26912,0.644,0.902,227,1,"MK.5108, barasertib, barasertib.HQPA, SNS.314",0.0447934624580583,0,FALSE
"HCC827","Pearson.est","bacterial 50S ribosomal subunit inhibitor",0.24339,0.6,0.929,426,1,"valnemulin, radezolid, josamycin",0.0319842860063582,0,FALSE
"HCC827","Pearson.est","bacterial DNA gyrase inhibitor",-0.24101,-0.606,0.912,1331,0.94,"finafloxacin",0.0400051616715838,0.0268721464003014,FALSE
"HCC827","Pearson.est","BCL inhibitor",0.4275,1.03,0.397,265,0.751,"ABT.737, TW.37, gossypol, venetoclax",0.401209493236885,0.124360062995832,FALSE
"HCC827","Pearson.est","Bcr.Abl kinase inhibitor",-0.44138,-1.11,0.329,1415,0.68,"dasatinib, bosutinib",0.482804102050026,0.167491087293764,FALSE
"HCC827","Pearson.est","benzodiazepine receptor agonist",0.24458,0.587,0.927,529,1,"bentazepam, indiplon, zaleplon, nefiracetam, CL.218872, lorazepam",0.0329202658555029,0,FALSE
"HCC827","Pearson.est","bromodomain inhibitor",-0.26859,-0.659,0.849,919,0.944,"PFI.1, OTX015, I.BET151, I.BET.762, JQ1....",0.0710923097560473,0.025028005701931,FALSE
"HCC827","Pearson.est","calcium channel blocker",0.49347,1.2,0.266,103,0.674,"carboxyamidotriazole, pranidipine, mibefradil",0.575118363368933,0.17134010346468,FALSE
"HCC827","Pearson.est","CC chemokine receptor antagonist",0.35363,0.871,0.612,326,0.893,"SB.225002, UNBS.5162",0.213248577854439,0.0491485411114536,FALSE
"HCC827","Pearson.est","CDK inhibitor",0.17028,0.423,0.996,693,0.995,"abemaciclib, dinaciclib, NU6027, palbociclib, P276.00, R547, indirubin, BMS.387032, AZD5438, PHA.848125, ribociclib",0.00174066157630127,0.00217691925427455,FALSE
"HCC827","Pearson.est","CHK inhibitor",-0.45868,-1.1,0.35,1210,0.658,"CHIR.124, LY2603618",0.455931955649724,0.181774106386044,FALSE
"HCC827","Pearson.est","cyclooxygenase inhibitor",-0.2862,-0.697,0.815,1240,0.926,"tryptanthrin, FK.3311, ketoprofen, aspirin, phenazone, ramifenazone",0.0888423912600234,0.0333890133180656,FALSE
"HCC827","Pearson.est","cytochrome P450 inhibitor",0.67592,1.64,0.0409,474,0.825,"metyrapone, clotrimazole, cobicistat, morin, itraconazole, eplerenone, PF.4981517",1.38827669199266,0.0835460514500749,FALSE
"HCC827","Pearson.est","DNA alkylating agent",0.47989,1.17,0.288,244,0.705,"carboplatin, carmustine, dianhydrogalactitol, TH.302, temozolomide, streptozotocin, cisplatin",0.540607512240769,0.151810883008601,FALSE
"HCC827","Pearson.est","DNA inhibitor",0.51846,1.26,0.206,153,0.618,"pibenzimol, carboplatin, chlorambucil, carmustine, valrubicin",0.686132779630847,0.209011524911184,FALSE
"HCC827","Pearson.est","DNA methyltransferase inhibitor",-0.43421,-1.08,0.346,1262,0.655,"azacitidine, SGI.1027, fdcyd, decitabine",0.460923901207223,0.183758700008217,FALSE
"HCC827","Pearson.est","DNA polymerase inhibitor",0.27659,0.681,0.861,206,1,"menadione, foscarnet",0.0649968485463452,0,FALSE
"HCC827","Pearson.est","DNA synthesis inhibitor",0.56241,1.39,0.115,430,0.522,"altretamine, artemisinin, cisplatin, cyclocytidine, azodicarbonamide, nelarabine, artesunate, estramustine.phosphate",0.939302159646388,0.282329496997738,FALSE
"HCC827","Pearson.est","dopamine receptor antagonist",0.3726,0.922,0.531,151,0.852,"raclopride, paliperidone, amisulpride, isofloxythepin",0.274905478918531,0.0695604052332999,FALSE
"HCC827","Pearson.est","estrogen receptor agonist",-0.23101,-0.588,0.923,1167,0.926,"ethinyl.estradiol, levonorgestrel",0.0347982989740879,0.0333890133180656,FALSE
"HCC827","Pearson.est","estrogen receptor antagonist",0.30921,0.742,0.776,222,0.962,"fulvestrant, danazol",0.110138278741812,0.0168249279621871,FALSE
"HCC827","Pearson.est","FGFR inhibitor",0.53219,1.29,0.185,479,0.627,"erdafitinib, dovitinib, orantinib, regorafenib, lenvatinib, nintedanib",0.732828271596986,0.202732459169284,FALSE
"HCC827","Pearson.est","FLT3 inhibitor",0.32677,0.777,0.732,671,0.932,"dovitinib, TG.101348, GTP.14564, ENMD.2076, ponatinib, tyrphostin.AG.1296, tozasertib, sunitinib, KW.2449, sorafenib, gilteritinib",0.135488918941608,0.0305840876460186,FALSE
"HCC827","Pearson.est","glucocorticoid receptor agonist",0.32466,0.778,0.708,404,0.954,"piretanide, dexamethasone.acetate, halcinonide, triamcinolone, prednisolone.hemisuccinate, flumethasone.pivalate, deflazacort, fluticasone.propionate",0.149966742310231,0.0204516252959049,FALSE
"HCC827","Pearson.est","glutamate receptor antagonist",0.43596,1.08,0.353,237,0.766,"felbamate, MTPG, CPP, ACDPP",0.452225294612177,0.115771230367396,FALSE
"HCC827","Pearson.est","glycogen synthase kinase inhibitor",-0.30594,-0.755,0.735,1403,0.94,"LY2090314",0.133712660915805,0.0268721464003014,FALSE
"HCC827","Pearson.est","growth factor receptor inhibitor",-0.48037,-1.2,0.241,1047,0.559,"GSK1904529A, GSK1838705A, AZD3463",0.617982957425132,0.252588192113577,FALSE
"HCC827","Pearson.est","HCV inhibitor",0.55059,1.34,0.158,201,0.598,"mericitabine, Ro.9187",0.801342913045577,0.223298816011589,FALSE
"HCC827","Pearson.est","HDAC inhibitor",-0.31618,-0.786,0.659,999,0.921,"chidamide, trichostatin.a, belinostat, vorinostat, RG2833, SB.939, PCI.24781, mocetinostat, tacedinaline, givinostat, panobinostat, JNJ.26481585",0.18111458540599,0.0357403698031511,FALSE
"HCC827","Pearson.est","histamine receptor antagonist",-0.29748,-0.752,0.746,1326,0.91,"ebastine, terfenadine, zolantidine, ranitidine",0.127261172527331,0.0409586076789064,FALSE
"HCC827","Pearson.est","HMGCR inhibitor",0.92284,2.27,0,26,0.00108,"atorvastatin, mevastatin, fluvastatin, pitavastatin",Inf,2.96657624451305,TRUE
"HCC827","Pearson.est","HSP inhibitor",-0.62481,-1.6,0.0696,1223,0.315,"guanidine, XL888, KW.2478, PU.H71, alvespimycin, VER.49009, BIIB021, tanespimycin",1.15739076038944,0.501689446210399,FALSE
"HCC827","Pearson.est","JAK inhibitor",-0.32706,-0.792,0.67,1327,0.949,"LY2784544, CEP.33779, ruxolitinib",0.173925197299174,0.0227337875727074,FALSE
"HCC827","Pearson.est","KIT inhibitor",0.23204,0.556,0.949,409,0.991,"pazopanib, motesanib, cediranib, regorafenib, KI.8751, lenvatinib",0.0227337875727074,0.00392634551472468,FALSE
"HCC827","Pearson.est","MDM inhibitor",0.65014,1.58,0.0556,70,0.48,"AMG.232, idasanutlin, nutlin.3",1.25492520841794,0.318758762624413,FALSE
"HCC827","Pearson.est","MEK inhibitor",-0.57674,-1.46,0.0989,1087,0.316,"PD.98059, PD.0325901, selumetinib, MEK1.2.inhibitor, PD.198306, refametinib, AS.703026, AZD8330, PD.184352, TAK.733, Ro.4987655, trametinib",1.00480370840282,0.500312917381596,FALSE
"HCC827","Pearson.est","MET inhibitor",-0.57239,-1.47,0.0804,1150,0.333,"PF.04217903, LY2801653, INC.280",1.09474395125155,0.47755576649368,FALSE
"HCC827","Pearson.est","microtubule inhibitor",0.41152,1.01,0.434,430,0.738,"secnidazole, vinblastine, triclabendazole, vinflunine, estramustine.phosphate",0.362510270487489,0.131943638176958,FALSE
"HCC827","Pearson.est","mTOR inhibitor",0.25857,0.635,0.882,551,1,"ku.0063794, XL388, OSI.027, SB.2343, torin.1, deforolimus, AZD2014, WAY.600, MLN0128, PF.04691502, LY3023414, PI.103",0.0545314148681803,0,FALSE
"HCC827","Pearson.est","NFkB pathway inhibitor",0.49243,1.21,0.233,506,0.688,"BAY.11.7082, betulinic.acid, parthenolide, tyloxapol, curcumin, IKK.2.inhibitor.V, EVP4593",0.632644078973981,0.162411561764489,FALSE
"HCC827","Pearson.est","opioid receptor agonist",-0.28724,-0.701,0.823,1350,0.954,"ADL5859",0.0846001647877302,0.0204516252959049,FALSE
"HCC827","Pearson.est","p38 MAPK inhibitor",-0.77205,-1.92,0.00227,1128,0.0562,"talmapimod, CMPD.1, SB.242235, VX.702, SB.239063, TAK.715",2.64397414280688,1.25026368443094,TRUE
"HCC827","Pearson.est","PARP inhibitor",0.42298,1.01,0.441,466,0.738,"AG.14361, endo.IWR.1, AZD2461, talazoparib",0.355561410532161,0.131943638176958,FALSE
"HCC827","Pearson.est","PDGFR tyrosine kinase receptor inhibitor",0.36762,0.886,0.609,505,0.893,"pazopanib, dovitinib, motesanib, orantinib, CP.673451, SU014813, axitinib, regorafenib, KI.8751, linifanib, lenvatinib, ponatinib, nintedanib, telatinib",0.215382707367125,0.0491485411114536,FALSE
"HCC827","Pearson.est","phosphatase inhibitor",0.59026,1.43,0.112,164,0.478,"bis.maltolato.oxovanadium.IV., GSK2830371, menadione, BVT.948",0.950781977329818,0.320572103387881,FALSE
"HCC827","Pearson.est","phosphodiesterase inhibitor",0.41996,1.03,0.421,61,0.751,"anagrelide, GSK256066",0.375717904164332,0.124360062995832,FALSE
"HCC827","Pearson.est","PI3K inhibitor",-0.25894,-0.654,0.878,1303,0.92,"PIK.75, TG.100713, CH5132799, alpelisib, taselisib",0.0565054840938974,0.0362121726544447,FALSE
"HCC827","Pearson.est","PLK inhibitor",-0.33737,-0.835,0.617,1145,0.996,"BI.2536, HMN.214, NMS.1286937",0.209714835966758,0.00174066157630127,FALSE
"HCC827","Pearson.est","potassium channel blocker",0.42736,1.04,0.421,253,0.788,"mepivacaine, dofetilide",0.375717904164332,0.103473782510445,FALSE
"HCC827","Pearson.est","PPAR receptor agonist",0.44061,1.07,0.383,21,0.756,"clofibrate",0.416801226031377,0.121478204498793,FALSE
"HCC827","Pearson.est","progesterone receptor agonist",0.52352,1.28,0.188,261,0.609,"norethindrone, tanaproget, norethindrone.acetate, danazol, norgestrel",0.72584215073632,0.215382707367125,FALSE
"HCC827","Pearson.est","proteasome inhibitor",0.53942,1.32,0.161,144,0.598,"MG.132, oprozomib",0.79317412396815,0.223298816011589,FALSE
"HCC827","Pearson.est","protein synthesis inhibitor",0.32788,0.811,0.686,432,0.95,"mercaptopurine, florfenicol, brefeldin.a, harringtonine, thiostrepton, clofoctol, methacycline",0.163675884293248,0.0222763947111523,FALSE
"HCC827","Pearson.est","protein tyrosine kinase inhibitor",-0.77439,-1.88,0.0136,1334,0.0654,"NVP.TAE226, CP.724714, BMS.599626, AV.412",1.86646109162978,1.18442225167573,TRUE
"HCC827","Pearson.est","RAF inhibitor",0.66353,1.61,0.0344,78,0.667,"dabrafenib, vemurafenib, SB.590885, TAK.632, AZ.628",1.46344155742847,0.175874166083451,FALSE
"HCC827","Pearson.est","RET tyrosine kinase inhibitor",-0.59339,-1.5,0.0776,1430,0.327,"vandetanib",1.11013827874181,0.485452247339714,FALSE
"HCC827","Pearson.est","retinoid receptor agonist",-0.32268,-0.797,0.652,1273,0.982,"adarotene, tamibarotene, CD.437",0.18575240426808,0.00788851221305034,FALSE
"HCC827","Pearson.est","ribonucleotide reductase inhibitor",0.65337,1.59,0.0536,148,0.568,"cladribine, triapine, pentostatin, clofarabine, hydroxyurea",1.27083521030723,0.245651664288981,FALSE
"HCC827","Pearson.est","serotonin receptor agonist",0.64701,1.57,0.0552,1,0.36,"aripiprazole",1.2580609222708,0.443697499232713,FALSE
"HCC827","Pearson.est","serotonin receptor antagonist",0.62152,1.54,0.0617,89,0.336,"aripiprazole, lerisetron, paliperidone, pirenperone",1.20971483596676,0.473660722610156,FALSE
"HCC827","Pearson.est","sodium channel blocker",0.60362,1.51,0.0669,186,0.357,"cibenzoline, butamben, mepivacaine, benzethonium, quinidine, oxcarbazepine",1.17457388223218,0.447331783887807,FALSE
"HCC827","Pearson.est","src inhibitor",-0.82886,-2.09,0,1415,0.0189,"dasatinib, bosutinib, ZM.306416, saracatinib",Inf,1.72353819582676,TRUE
"HCC827","Pearson.est","sterol demethylase inhibitor",0.40715,0.997,0.472,74,0.738,"posaconazole",0.326058001365912,0.131943638176958,FALSE
"HCC827","Pearson.est","TGF beta receptor inhibitor",-0.33738,-0.853,0.609,1110,1,"D.4476, SB.431542, repsox",0.215382707367125,0,FALSE
"HCC827","Pearson.est","thymidylate synthase inhibitor",0.22798,0.563,0.955,436,1,"doxifluridine, ftorafur",0.0199966284162537,0,FALSE
"HCC827","Pearson.est","topoisomerase inhibitor",0.32487,0.797,0.706,290,0.949,"doxorubicin, etoposide.phosphate, epirubicin, valrubicin, beta.lapachone, voreloxin, dexrazoxane, nemorubicin, teniposide",0.151195298948196,0.0227337875727074,FALSE
"HCC827","Pearson.est","tubulin polymerization inhibitor",0.19021,0.459,0.995,309,1,"taltobulin, vindesine, vinblastine, vinorelbine, BNC105, verubulin",0.00217691925427455,0,FALSE
"HCC827","Pearson.est","tyrosine kinase inhibitor",-0.62052,-1.55,0.0748,1334,0.339,"NVP.TAE226, aminopurvalanol.a, tivantinib, dasatinib, CP.724714, BMS.599626, vandetanib, AV.412",1.12609840213554,0.469800301796918,FALSE
"HCC827","Pearson.est","VEGFR inhibitor",-0.41588,-1.01,0.451,1411,0.744,"AEE788, ZM.306416, vandetanib, XL.647, BMS.690514",0.345823458122039,0.128427064454121,FALSE
"HCC827","Pearson.est","vitamin D receptor agonist",-0.81049,-1.95,0,1246,0.0569,"calcitriol, paricalcitol, tacalcitol, ercalcitriol, maxacalcitol",Inf,1.24488773360493,TRUE
"HCC95","Pearson.est","EGFR inhibitor",-0.79651,-1.91,0.00531,1326,0.0578,"WZ.4002, BMS.599626, icotinib, GW.583340, BIBX.1382, rociletinib, tucatinib, CP.724714, TAK.285, brigatinib, ARRY.334543, AEE788, PD.168393, vandetanib, gefitinib, AST.1306, osimertinib, canertinib, neratinib, pelitinib, dacomitinib, BMS.690514, AZD8931, erlotinib, afatinib, poziotinib, lapatinib, XL.647",2.27490547891853,1.23807216157947,TRUE
"HCC95","Pearson.est","Abl kinase inhibitor",-0.64044,-1.54,0.0724,1237,0.2,"metatinib, imatinib, tozasertib, ZM.306416, dasatinib, bosutinib",1.14026143380285,0.698970004336019,FALSE
"HCC95","Pearson.est","acetylcholine receptor agonist",0.32434,0.896,0.543,191,0.706,"nicotine, nefiracetam",0.265200170411153,0.151195298948196,FALSE
"HCC95","Pearson.est","acetylcholine receptor antagonist",0.56651,1.57,0.0556,287,0.252,"diphemanil, dicycloverine, iododexetimide",1.25492520841794,0.598599459218456,FALSE
"HCC95","Pearson.est","adenosine receptor antagonist",-0.49369,-1.19,0.259,1406,0.479,"CGS.15943",0.586700235918748,0.319664486585437,FALSE
"HCC95","Pearson.est","adrenergic receptor agonist",-0.295,-0.701,0.812,773,0.959,"metaraminol, oxymetazoline, norepinephrine, A61603, epinephrine, clenbuterol, midodrine, isoxsuprine, buphenine",0.0904439707588247,0.0181813928293364,FALSE
"HCC95","Pearson.est","adrenergic receptor antagonist",-0.27045,-0.631,0.883,869,0.973,"dihydroergocristine, pindolol, atipamezole, dronedarone, vincamine, idazoxan, naftidrofuryl, RS.17053, practolol",0.0540392964224314,0.0118871597316481,FALSE
"HCC95","Pearson.est","AKT inhibitor",-0.46959,-1.09,0.384,1058,0.612,"ONC201, A.674563, CCT128930, uprosertib, triciribine",0.415668775632469,0.213248577854439,FALSE
"HCC95","Pearson.est","ALK tyrosine kinase receptor inhibitor",-0.65596,-1.56,0.0427,1096,0.287,"alectinib, SB.505124, NVP.TAE684, lorlatinib, GW.788388, crizotinib, AZD3463, AP26113, brigatinib",1.36957212497498,0.542118103266008,FALSE
"HCC95","Pearson.est","androgen receptor antagonist",0.47349,1.34,0.142,355,0.328,"bicalutamide, nilutamide, RU.58841, flutamide",0.847711655616944,0.484126156288321,FALSE
"HCC95","Pearson.est","antioxidant",0.51443,1.44,0.131,340,0.273,"trolox, benfotiamine, mesna, taurine",0.882728704344236,0.563837352959244,FALSE
"HCC95","Pearson.est","AP inhibitor",0.6975,1.96,0.0198,251,0.098,"idronoxil, GDC.0152, LCL.161",1.70333480973847,1.00877392430751,TRUE
"HCC95","Pearson.est","ATPase inhibitor",-0.19584,-0.469,0.989,1158,1,"digitoxigenin, k.strophanthidin",0.0048037084028206,0,FALSE
"HCC95","Pearson.est","Aurora kinase inhibitor",-0.56769,-1.36,0.146,903,0.356,"ZM.447439, MLN.8054, KW.2449, AT.9283, alisertib, MK.8745, ENMD.2076, aurora.a.inhibitor.i, TAK.901, CCT129202, PF.03814735, CYC116, barasertib, PHA.680632, danusertib, tozasertib, GSK1070916, hesperadin",0.835647144215563,0.448550002027125,FALSE
"HCC95","Pearson.est","bacterial 50S ribosomal subunit inhibitor",-0.43856,-1.06,0.379,1129,0.628,"azithromycin, tedizolid",0.421360790031928,0.202040356262804,FALSE
"HCC95","Pearson.est","bacterial DNA gyrase inhibitor",0.42097,1.14,0.311,278,0.471,"sparfloxacin, norfloxacin, sarafloxacin, nadifloxacin",0.507239610973163,0.326979092871104,FALSE
"HCC95","Pearson.est","BCL inhibitor",0.2468,0.674,0.841,20,0.908,"ABT.737",0.0752040042020878,0.0419141514789149,FALSE
"HCC95","Pearson.est","Bcr.Abl kinase inhibitor",-0.64196,-1.54,0.0461,1237,0.2,"metatinib, imatinib, tozasertib, dasatinib, bosutinib",1.33629907461035,0.698970004336019,TRUE
"HCC95","Pearson.est","benzodiazepine receptor agonist",0.4647,1.27,0.18,191,0.381,"indiplon, zaleplon, temazepam, nefiracetam",0.744727494896694,0.419075024324381,FALSE
"HCC95","Pearson.est","bromodomain inhibitor",0.52547,1.45,0.128,246,0.288,"bromosporine, I.BET151, PFI.1",0.892790030352132,0.540607512240769,FALSE
"HCC95","Pearson.est","calcium channel blocker",-0.35359,-0.843,0.666,1223,0.819,"SKF.96365, penfluridol",0.176525770829699,0.0867160982395816,FALSE
"HCC95","Pearson.est","CC chemokine receptor antagonist",0.22396,0.62,0.902,84,0.936,"SB.225002",0.0447934624580583,0.0287241512618947,FALSE
"HCC95","Pearson.est","CDK inhibitor",-0.55669,-1.33,0.154,959,0.368,"dinaciclib, ribociclib, BMS.387032, AZD5438, JNJ.7706621, BMS.265246, R547, palbociclib, alvocidib, PHA.793887, AT.7519, aminopurvalanol.a, PHA.848125, indisulam",0.812479279163537,0.434152181326482,FALSE
"HCC95","Pearson.est","CHK inhibitor",-0.38846,-0.93,0.569,782,0.779,"LY2606368, AZD7762, CHIR.124, LY2603618",0.244887733604929,0.108462542327436,FALSE
"HCC95","Pearson.est","cyclooxygenase inhibitor",-0.19378,-0.464,0.985,1062,0.988,"AM.404, ramifenazone, FK.3311, amfenac, aspirin, phenazone",0.00656376950238827,0.00524305541237188,FALSE
"HCC95","Pearson.est","cytochrome P450 inhibitor",0.55149,1.48,0.0952,339,0.284,"metyrapone, clotrimazole, cobicistat, morin",1.02136305161553,0.546681659952962,FALSE
"HCC95","Pearson.est","DNA alkylating agent",-0.43797,-1.05,0.403,1189,0.608,"estramustine, cyclophosphamide, mitomycin.c, dacarbazine",0.39469495385889,0.216096420727265,FALSE
"HCC95","Pearson.est","DNA inhibitor",0.44048,1.19,0.276,258,0.431,"pibenzimol, chlorambucil, bendamustine, melphalan, carboplatin",0.559090917934782,0.365522729839268,FALSE
"HCC95","Pearson.est","DNA methyltransferase inhibitor",-0.64487,-1.54,0.045,1317,0.2,"fdcyd, azacitidine, decitabine",1.34678748622466,0.698970004336019,TRUE
"HCC95","Pearson.est","DNA polymerase inhibitor",0.29477,0.79,0.646,29,0.86,"menadione",0.189767482004916,0.0655015487564323,FALSE
"HCC95","Pearson.est","DNA synthesis inhibitor",-0.29483,-0.703,0.812,875,0.979,"altretamine, floxuridine, cyclocytidine, CB.10.277, enocitabine, capecitabine, anisomycin, mitomycin.c",0.0904439707588247,0.00921730819686218,FALSE
"HCC95","Pearson.est","dopamine receptor antagonist",0.341,0.942,0.497,343,0.66,"amisulpride, raclopride, sertindole, domperidone, paliperidone, remoxipride, nemonapride, lurasidone",0.303643611266668,0.180456064458131,FALSE
"HCC95","Pearson.est","estrogen receptor agonist",-0.433,-1.03,0.417,1112,0.623,"ethinyl.estradiol, levonorgestrel",0.379863945026242,0.20551195334083,FALSE
"HCC95","Pearson.est","estrogen receptor antagonist",0.49594,1.34,0.158,250,0.328,"toremifene, fulvestrant, danazol",0.801342913045577,0.484126156288321,FALSE
"HCC95","Pearson.est","FGFR inhibitor",-0.38835,-0.911,0.568,923,0.769,"nintedanib, AZD4547, MK.2461, PD.173074, dovitinib, lenvatinib, lucitanib",0.245651664288981,0.114073660198569,FALSE
"HCC95","Pearson.est","FLT3 inhibitor",-0.45795,-1.11,0.338,850,0.596,"tyrphostin.AG.1296, quizartinib, ponatinib, lestaurtinib, KW.2449, sunitinib, dovitinib, gilteritinib, ENMD.2076, midostaurin, pacritinib, sorafenib, tozasertib",0.471083299722345,0.224753740259764,FALSE
"HCC95","Pearson.est","glucocorticoid receptor agonist",-0.24566,-0.592,0.925,777,0.966,"rimexolone, fluocinolone.acetonide, methylprednisolone, fludroxycortide, fluticasone.propionate, flumethasone.pivalate, desonide, prednisolone.acetate, clobetasol.propionate, halobetasol.propionate, difluprednate, hydrocortisone, fluorometholone, triamcinolone.acetonide, betamethasone, ciclesonide, flumethasone",0.0338582672609674,0.0150228735845067,FALSE
"HCC95","Pearson.est","glutamate receptor antagonist",0.34253,0.949,0.503,269,0.677,"MTPG, ACDPP, JNJ.16259685, felbamate, IEM1754",0.298432014944073,0.169411331314856,FALSE
"HCC95","Pearson.est","glycogen synthase kinase inhibitor",0.2467,0.676,0.839,1093,0.937,"CHIR.98014, CHIR.99021, GSK.3.inhibitor.IX, indirubin, tideglusib, kenpaullone, AZD2858, TWS.119, LY2090314",0.0762380391712997,0.0282604091122217,FALSE
"HCC95","Pearson.est","growth factor receptor inhibitor",-0.64875,-1.57,0.0431,1185,0.306,"GSK1838705A, danusertib, AZD3463, PHA.848125",1.36552272983927,0.51427857351842,FALSE
"HCC95","Pearson.est","HCV inhibitor",0.57327,1.57,0.0686,120,0.252,"mericitabine, Ro.9187",1.16367588429325,0.598599459218456,FALSE
"HCC95","Pearson.est","HDAC inhibitor",-0.35418,-0.856,0.65,860,0.818,"RGFP966, trichostatin.a, JNJ.26481585, SB.939, romidepsin, panobinostat, tacedinaline, givinostat, resminostat, dacinostat, belinostat, vorinostat, chidamide",0.187086643357144,0.087246696328677,FALSE
"HCC95","Pearson.est","histamine receptor antagonist",-0.28589,-0.684,0.839,1027,0.938,"terfenadine, BF2.649, ranitidine, zolantidine, ebastine, levocetirizine",0.0762380391712997,0.0277971616209356,FALSE
"HCC95","Pearson.est","HMGCR inhibitor",0.7865,2.15,0.0134,285,0.101,"atorvastatin, mevastatin, fluvastatin, simvastatin, pitavastatin",1.87289520163519,0.995678626217357,TRUE
"HCC95","Pearson.est","HSP inhibitor",-0.70905,-1.73,0.0231,1220,0.162,"alvespimycin, XL888, tanespimycin, ganetespib, NVP.AUY922, VER.49009, PU.H71, BIIB021",1.63638802010786,0.790484985457369,TRUE
"HCC95","Pearson.est","JAK inhibitor",-0.56921,-1.38,0.125,910,0.412,"lestaurtinib, TG.101209, filgotinib, PRT062070, AT.9283, AZ960, LY2784544, baricitinib, WHI.P154, AZD1480, pacritinib, tozasertib, CEP.33779, ruxolitinib",0.903089986991944,0.385102783966865,FALSE
"HCC95","Pearson.est","KIT inhibitor",-0.50623,-1.2,0.261,1184,0.48,"lenvatinib, midostaurin, sorafenib, imatinib, dasatinib",0.583359492661719,0.318758762624413,FALSE
"HCC95","Pearson.est","MDM inhibitor",0.74932,2.04,0.00397,150,0.0742,"AMG.232, idasanutlin, CGM097, nutlin.3",2.40120949323688,1.12959609472097,TRUE
"HCC95","Pearson.est","MEK inhibitor",0.57934,1.58,0.0584,220,0.313,"U.0126, cobimetinib, selumetinib, MEK1.2.inhibitor, BIX.02188, MEK162, refametinib, AS.703026, PD.318088",1.2335871528876,0.504455662453552,FALSE
"HCC95","Pearson.est","MET inhibitor",-0.6514,-1.57,0.048,1388,0.306,"INC.280, LY2801653",1.31875876262441,0.51427857351842,FALSE
"HCC95","Pearson.est","microtubule inhibitor",-0.58123,-1.38,0.118,958,0.412,"vinblastine, cytochalasin.b, triclabendazole, colchicine, vinflunine, podophyllotoxin, D.64131, cabazitaxel",0.928117992693875,0.385102783966865,FALSE
"HCC95","Pearson.est","mTOR inhibitor",-0.37838,-0.903,0.584,905,0.762,"PKI.179, MLN0128, temsirolimus, WYE.354, NVP.BEZ235, torin.1, voxtalisib, GSK2126458, AZD8055, GDC.0980, PF.05212384, sirolimus, deforolimus, everolimus, torin.2",0.233587152887601,0.1180450286604,FALSE
"HCC95","Pearson.est","NFkB pathway inhibitor",0.35237,0.951,0.492,942,0.704,"tyloxapol, BAY.11.7082, parthenolide, parthenolide...., IKK.2.inhibitor.V, bindarit, bortezomib, betulinic.acid, Ro.106.9920, curcumin, BAY.11.7085, EVP4593",0.30803489723264,0.152427340857888,FALSE
"HCC95","Pearson.est","opioid receptor agonist",0.39186,1.09,0.336,42,0.522,"BW.180C",0.473660722610156,0.282329496997738,FALSE
"HCC95","Pearson.est","p38 MAPK inhibitor",-0.51498,-1.23,0.235,879,0.464,"skepinone.l, CMPD.1, SB.239063, SB.242235, talmapimod",0.628932137728264,0.333482019445119,FALSE
