"type","Rank_metric","Drug_set","ES","NES","p_value","Position_at_max","FDR_q_value","Leading_edge","minusLogP","minusLogFDR","sig"
"H1975","Pearson.est","CDK inhibitor",0.34675,0.874,0.604,299,0.887,"indisulam, arcyriaflavin.a, BMS.387032, aminopurvalanol.a, PHA.793887, AT.7519, TG.02",0.218963061378868,0.0520763801682736,FALSE
"H1975","Pearson.est","CHK inhibitor",0.27227,0.685,0.863,347,1,"PF.477736, CHIR.124, SB.218078",0.0639892042847904,0,FALSE
"H1975","Pearson.est","cyclooxygenase inhibitor",0.23137,0.579,0.942,430,1,"ramifenazone, phenazone, pterostilbene, FR.122047, tryptanthrin, amfenac, AM.404, aspirin, meloxicam",0.0259490972071227,0,FALSE
"H1975","Pearson.est","cytochrome P450 inhibitor",-0.79362,-2.02,0.00444,1229,0.0606,"PF.4981517, cobicistat, morin, clotrimazole, eplerenone, metyrapone",2.35261702988538,1.21752737583371,TRUE
"H1975","Pearson.est","DNA alkylating agent",0.28129,0.697,0.839,204,1,"dacarbazine, mitomycin.c, satraplatin, estramustine",0.0762380391712997,0,FALSE
"H1975","Pearson.est","DNA inhibitor",-0.36787,-0.965,0.5,1163,0.732,"metronidazole, sangivamycin, pibenzimol, carmustine, carboplatin",0.301029995663981,0.135488918941608,FALSE
"H1975","Pearson.est","DNA methyltransferase inhibitor",0.64463,1.59,0.0548,175,0.341,"SGI.1027, decitabine, fdcyd, azacitidine",1.26121944151563,0.467245621007502,FALSE
"H1975","Pearson.est","DNA polymerase inhibitor",0.40126,0.981,0.472,128,0.893,"cephalomannine, cidofovir",0.326058001365912,0.0491485411114536,FALSE
"H1975","Pearson.est","DNA synthesis inhibitor",-0.29204,-0.756,0.723,926,0.888,"cyclocytidine, capecitabine, cisplatin, artesunate, artemisinin, azodicarbonamide, CB.10.277, estramustine.phosphate, altretamine, nelarabine",0.140861702705469,0.051587034221399,FALSE
"H1975","Pearson.est","dopamine receptor antagonist",-0.38458,-0.998,0.427,1143,0.702,"nemonapride, UH.232...., paliperidone, isofloxythepin, amisulpride, raclopride",0.369572124974976,0.153662887870195,FALSE
"H1975","Pearson.est","estrogen receptor agonist",-0.42262,-1.05,0.359,1038,0.703,"equol, PPT, estradiol.cypionate, estradiol",0.444905551421681,0.153044674980176,FALSE
"H1975","Pearson.est","estrogen receptor antagonist",0.37583,0.937,0.524,515,0.882,"clomifene, tamoxifen, danazol",0.280668713016273,0.0545314148681803,FALSE
"H1975","Pearson.est","FGFR inhibitor",-0.19439,-0.49,0.971,976,0.983,"MK.2461, AZD4547, erdafitinib, orantinib",0.0127807700919951,0.00744648216786438,FALSE
"H1975","Pearson.est","FLT3 inhibitor",0.24811,0.617,0.91,442,1,"pacritinib, sorafenib, TG.02, ENMD.2076, lestaurtinib, tyrphostin.AG.1296, dovitinib",0.0409586076789064,0,FALSE
"H1975","Pearson.est","glucocorticoid receptor agonist",-0.26524,-0.68,0.834,1161,0.918,"flumethasone.pivalate, prednisolone.hemisuccinate, dexamethasone.acetate, hydrocortisone, fluocinolone.acetonide, fluticasone.propionate, piretanide",0.0788339493622613,0.0371573187987575,FALSE
"H1975","Pearson.est","glutamate receptor antagonist",0.13612,0.337,1,558,1,"CGP.37849, tiletamine, ACDPP, felbamate, LY456236, CPP",0,0,FALSE
"H1975","Pearson.est","glycogen synthase kinase inhibitor",-0.52838,-1.34,0.172,1316,0.494,"CHIR.99021, tideglusib, CHIR.98014",0.764471553092451,0.306273051076353,FALSE
"H1975","Pearson.est","growth factor receptor inhibitor",0.58961,1.48,0.105,474,0.384,"danusertib, AZD3463, lestaurtinib, GSK1838705A, GW.441756",0.978810700930062,0.415668775632469,FALSE
"H1975","Pearson.est","HCV inhibitor",-0.30711,-0.791,0.727,1131,0.893,"embelin, Ro.9187",0.138465589140962,0.0491485411114536,FALSE
"H1975","Pearson.est","HDAC inhibitor",0.65305,1.65,0.0335,373,0.281,"PCI.24781, SB.939, givinostat, M.344, trichostatin.a, vorinostat, AR.42, scriptaid, R306465, chidamide, JNJ.26481585, dacinostat, pyroxamide, belinostat, tacedinaline, NSC.3852, resminostat, panobinostat",1.47495519296315,0.55129368009492,FALSE
"H1975","Pearson.est","histamine receptor antagonist",-0.20588,-0.539,0.964,977,0.992,"ICI.162846, famotidine, pheniramine, cimetidine, tiotidine, BF2.649, nizatidine, chloropyramine, lafutidine",0.0159229660971692,0.00348832784582135,FALSE
"H1975","Pearson.est","HMGCR inhibitor",-0.88112,-2.35,0,1303,0,"simvastatin, atorvastatin, fluvastatin, mevastatin, pitavastatin",Inf,Inf,TRUE
"H1975","Pearson.est","HSP inhibitor",0.58885,1.42,0.12,250,0.361,"tanespimycin, KW.2478, BIIB021, VER.49009, alvespimycin",0.920818753952375,0.442492798094342,FALSE
"H1975","Pearson.est","JAK inhibitor",0.39335,0.957,0.488,628,0.907,"LY2784544, pacritinib, CEP.33779, TG.02, WHI.P154, lestaurtinib, AZD1480, TG.101348, baricitinib, ruxolitinib, PRT062070, TG.101209",0.311580177997289,0.0423927129399047,FALSE
"H1975","Pearson.est","KIT inhibitor",0.19981,0.493,0.976,257,1,"OSI.930, sorafenib, imatinib",0.0105501823333082,0,FALSE
"H1975","Pearson.est","MDM inhibitor",-0.73553,-1.88,0.0166,1348,0.0806,"CGM097, nutlin.3, AMG.232, idasanutlin",1.77989191195995,1.09366495819491,TRUE
"H1975","Pearson.est","MEK inhibitor",0.20079,0.492,0.985,653,1,"PD.198306, PD.98059, PD.0325901, trametinib, TAK.733, Ro.4987655, MEK162, AS.703026, AZD8330, selumetinib, MEK1.2.inhibitor, PD.184352",0.00656376950238827,0,FALSE
"H1975","Pearson.est","MET inhibitor",0.46069,1.12,0.326,316,0.74,"INC.280, NVP.BVU972, AMG458",0.486782399932061,0.130768280269024,FALSE
"H1975","Pearson.est","microtubule inhibitor",-0.29117,-0.738,0.759,1159,0.861,"vinblastine, estramustine.phosphate, secnidazole",0.11975822410452,0.0649968485463452,FALSE
"H1975","Pearson.est","mTOR inhibitor",0.19739,0.482,0.974,555,1,"GSK2126458, PF.05212384, PKI.179, AZD8055, sirolimus, torin.2, PI.103, everolimus, voxtalisib, WYE.125132, PP242, deforolimus, GDC.0980, PF.04691502",0.0114410431213845,0,FALSE
"H1975","Pearson.est","NFkB pathway inhibitor",0.24686,0.62,0.9,505,1,"EVP4593, Ro.106.9920, parthenolide...., bindarit, tyloxapol",0.0457574905606751,0,FALSE
"H1975","Pearson.est","opioid receptor agonist",-0.66214,-1.7,0.0278,1217,0.211,"spiradoline, BW.180C, cebranopadol",1.55595520408192,0.675717544702307,TRUE
"H1975","Pearson.est","p38 MAPK inhibitor",0.62102,1.53,0.0585,339,0.368,"talmapimod, SB.239063, SB.242235, TAK.715",1.23284413391782,0.434152181326482,FALSE
"H1975","Pearson.est","PARP inhibitor",0.3551,0.877,0.61,193,0.912,"PJ.34, niraparib",0.214670164989233,0.0400051616715838,FALSE
"H1975","Pearson.est","PDGFR tyrosine kinase receptor inhibitor",-0.34107,-0.884,0.605,1093,0.789,"telatinib, pazopanib, dasatinib, ponatinib, orantinib, KI.8751, SU014813, CP.673451",0.218244625347531,0.10292299679058,FALSE
"H1975","Pearson.est","phosphatase inhibitor",-0.50199,-1.29,0.192,1360,0.538,"bis.maltolato.oxovanadium.IV., BVT.948, GSK2830371",0.71669877129645,0.269217724333611,FALSE
"H1975","Pearson.est","phosphodiesterase inhibitor",-0.41842,-1.08,0.363,1299,0.68,"YM.976, anagrelide, GSK256066",0.440093374963888,0.167491087293764,FALSE
"H1975","Pearson.est","PI3K inhibitor",0.40705,1.01,0.426,221,0.866,"taselisib, alpelisib, CH5132799, CUDC.907, GSK2126458, PF.05212384, PIK.75, GDC.0941",0.370590400897281,0.0624821079826534,FALSE
"H1975","Pearson.est","PLK inhibitor",0.75172,1.87,0.0054,201,0.0698,"BI.2536, NMS.1286937, HMN.214, volasertib",2.26760624017703,1.15614457737684,TRUE
"H1975","Pearson.est","potassium channel blocker",-0.63988,-1.68,0.035,1233,0.176,"ibutilide, meglitinide, mepivacaine",1.45593195564972,0.75448733218585,TRUE
"H1975","Pearson.est","PPAR receptor agonist",-0.36532,-0.949,0.513,1314,0.732,"clofibrate, fenofibrate",0.289882634888184,0.135488918941608,FALSE
"H1975","Pearson.est","progesterone receptor agonist",-0.52475,-1.39,0.131,1202,0.498,"norgestrel, norethindrone.acetate, norethindrone",0.882728704344236,0.302770657240282,FALSE
"H1975","Pearson.est","proteasome inhibitor",-0.48543,-1.28,0.181,1048,0.515,"bortezomib, ixazomib, MG.132, oprozomib, ixazomib.citrate",0.742321425130815,0.288192770958809,FALSE
"H1975","Pearson.est","protein synthesis inhibitor",0.52566,1.28,0.199,216,0.532,"bruceantin, anguidine, homoharringtonine, thiostrepton, tedizolid.phosphate, puromycin, clofoctol, cycloheximide",0.701146923590293,0.274088367704952,FALSE
"H1975","Pearson.est","protein tyrosine kinase inhibitor",0.77353,1.91,0.00678,228,0.0825,"CP.724714, BMS.599626, AV.412, tyrphostin.A9, mubritinib, NVP.TAE226",2.16877030613294,1.08354605145007,TRUE
"H1975","Pearson.est","RAF inhibitor",-0.4286,-1.11,0.329,1265,0.66,"LGX818, dabrafenib, vemurafenib",0.482804102050026,0.180456064458131,FALSE
"H1975","Pearson.est","RET tyrosine kinase inhibitor",0.45105,1.1,0.346,202,0.746,"vandetanib, sorafenib",0.460923901207223,0.127261172527331,FALSE
"H1975","Pearson.est","retinoid receptor agonist",0.59722,1.45,0.111,341,0.37,"adarotene, tamibarotene, fenretinide, CD.437, bexarotene, adapalene",0.954677021213343,0.431798275933005,FALSE
"H1975","Pearson.est","ribonucleotide reductase inhibitor",-0.52379,-1.34,0.173,937,0.494,"fludarabine, pentostatin, cytarabine, gemcitabine, hydroxyurea, triapine, clofarabine, cladribine",0.761953896871205,0.306273051076353,FALSE
"H1975","Pearson.est","serotonin receptor agonist",-0.72293,-1.92,0.00939,1407,0.0748,"ipsapirone, SR.57227A",2.02733440773389,1.12609840213554,TRUE
"H1975","Pearson.est","serotonin receptor antagonist",0.28969,0.707,0.809,223,1,"SB.200646, lurasidone, SB.228357",0.0920514783877277,0,FALSE
"H1975","Pearson.est","sodium channel blocker",-0.3868,-1,0.421,1187,0.729,"quinidine, mepivacaine, butamben, cibenzoline, oxcarbazepine",0.375717904164332,0.137272471682025,FALSE
"H1975","Pearson.est","src inhibitor",0.45394,1.14,0.303,303,0.736,"ZM.306416, saracatinib, bosutinib, KX2.391",0.518557371497695,0.133122185662501,FALSE
"H1975","Pearson.est","sterol demethylase inhibitor",-0.43594,-1.13,0.323,1085,0.66,"ketoconazole, terconazole, sulconazole",0.490797477668897,0.180456064458131,FALSE
"H1975","Pearson.est","TGF beta receptor inhibitor",-0.29958,-0.781,0.702,432,0.879,"repsox, D.4476, SB.431542, adaprev, SB.525334, LY2109761",0.153662887870195,0.0560111249262281,FALSE
"H1975","Pearson.est","thymidylate synthase inhibitor",0.28988,0.725,0.804,1030,1,"carmofur, raltitrexed, trifluridine, doxifluridine, capecitabine, ftorafur",0.0947439512515487,0,FALSE
"H1975","Pearson.est","topoisomerase inhibitor",0.42143,1.06,0.357,499,0.799,"amonafide, exatecan.mesylate, camptothecin, irinotecan, amsacrine, genz.644282, valrubicin, mitoxantrone, SN.38, idarubicin, teniposide, daunorubicin, doxorubicin",0.447331783887807,0.0974532206860086,FALSE
"H1975","Pearson.est","tubulin polymerization inhibitor",0.54913,1.38,0.12,317,0.397,"nocodazole, albendazole, fosbretabulin, parbendazole, fenbendazole, plinabulin, indibulin, paclitaxel, vinorelbine, mebendazole, vincristine, KX2.391, docetaxel, dolastatin.10, oxibendazole",0.920818753952375,0.401209493236885,FALSE
"H1975","Pearson.est","tyrosine kinase inhibitor",0.61601,1.53,0.0929,228,0.368,"CP.724714, BMS.599626, AV.412, tivantinib, tyrphostin.A9, mubritinib, vandetanib, aminopurvalanol.a, sorafenib, NVP.TAE226",1.03198428600636,0.434152181326482,FALSE
"H1975","Pearson.est","VEGFR inhibitor",0.36187,0.898,0.574,471,0.933,"BMS.690514, AEE788, ZM.306416, OSI.930, XL.647, vandetanib, sorafenib, PD.173074, ENMD.2076, tivozanib, axitinib, foretinib, dovitinib, TG.100572, regorafenib, golvatinib, vatalanib",0.241088107602027,0.0301183562535,FALSE
"H1975","Pearson.est","vitamin D receptor agonist",0.75925,1.9,0.00693,264,0.0678,"maxacalcitol, tacalcitol, calcitriol, ercalcitriol, paricalcitol",2.15926676538819,1.16877030613294,TRUE
"H2009","Pearson.est","EGFR inhibitor",-0.85853,-2.14,0,1319,0.0146,"GW.583340, PD.153035, WZ8040, CUDC.101, AEE788, BIBX.1382, brigatinib, BMS.599626, WZ.4002, BIBU.1361, icotinib, AST.1306, TAK.285, CP.724714, rociletinib, PD.168393, tucatinib, gefitinib, ARRY.334543, vandetanib, lapatinib, XL.647, erlotinib, neratinib, BMS.690514, dacomitinib, osimertinib, AZD8931, pelitinib, poziotinib, canertinib, afatinib",Inf,1.83564714421556,TRUE
"H2009","Pearson.est","Abl kinase inhibitor",-0.57232,-1.37,0.147,1408,0.471,"dasatinib, ZM.306416, bosutinib",0.832682665251824,0.326979092871104,FALSE
"H2009","Pearson.est","acetylcholine receptor agonist",0.4241,1.08,0.344,75,0.69,"nefiracetam, nicotine",0.46344155742847,0.161150909262745,FALSE
"H2009","Pearson.est","acetylcholine receptor antagonist",0.68339,1.73,0.0234,409,0.194,"dicycloverine, iododexetimide, diphemanil, methscopolamine",1.63078414258986,0.712198270069774,TRUE
"H2009","Pearson.est","adenosine receptor antagonist",-0.39966,-0.982,0.462,1429,0.75,"CGS.15943",0.335358024443874,0.1249387366083,FALSE
"H2009","Pearson.est","adrenergic receptor agonist",-0.42,-1.03,0.407,1023,0.753,"metaraminol, lidamidine, A61603, clenbuterol, buphenine, epinephrine, isoxsuprine",0.39040559077478,0.123205023799299,FALSE
"H2009","Pearson.est","adrenergic receptor antagonist",-0.23291,-0.577,0.941,1010,0.955,"naftidrofuryl, imiloxan, prazosin, propranolol, dronedarone, practolol, RS.17053, pindolol",0.0264103765727431,0.0199966284162537,FALSE
"H2009","Pearson.est","AKT inhibitor",-0.39427,-0.966,0.468,1107,0.723,"CCT128930, A.674563, uprosertib, triciribine",0.329754146925876,0.140861702705469,FALSE
"H2009","Pearson.est","ALK tyrosine kinase receptor inhibitor",-0.5675,-1.42,0.13,1171,0.421,"crizotinib, GW.788388, NVP.TAE684, AZD3463, AP26113, brigatinib",0.886056647693163,0.375717904164332,FALSE
"H2009","Pearson.est","androgen receptor antagonist",0.32216,0.846,0.628,347,0.824,"nilutamide, RU.58841",0.202040356262804,0.0840727883028842,FALSE
"H2009","Pearson.est","antioxidant",0.44778,1.12,0.33,283,0.683,"trolox, taurine",0.481486060122112,0.165579296318467,FALSE
"H2009","Pearson.est","AP inhibitor",0.56126,1.44,0.113,157,0.518,"GDC.0152, idronoxil, LCL.161",0.94692155651658,0.285670240254767,FALSE
"H2009","Pearson.est","ATPase inhibitor",0.34868,0.876,0.578,112,0.857,"digoxin, blebbistatin...., oligomycin.a",0.238072161579471,0.0670191780768018,FALSE
"H2009","Pearson.est","Aurora kinase inhibitor",-0.4014,-1,0.454,972,0.777,"PF.03814735, alisertib, KW.2449, ZM.447439, CYC116, hesperadin, TAK.901, danusertib, PHA.680632, aurora.a.inhibitor.i, GSK1070916, MLN.8054",0.342944147142896,0.109578981199086,FALSE
"H2009","Pearson.est","bacterial 50S ribosomal subunit inhibitor",-0.49043,-1.24,0.241,1120,0.598,"azalomycin.b, azithromycin, tedizolid",0.617982957425132,0.223298816011589,FALSE
"H2009","Pearson.est","bacterial DNA gyrase inhibitor",-0.20565,-0.505,0.977,1119,0.973,"lomefloxacin, finafloxacin",0.0101054362812269,0.0118871597316481,FALSE
"H2009","Pearson.est","BCL inhibitor",0.48647,1.24,0.248,186,0.658,"ABT.737, gossypol, TW.37",0.605548319173784,0.181774106386044,FALSE
"H2009","Pearson.est","Bcr.Abl kinase inhibitor",-0.48573,-1.17,0.276,1408,0.659,"dasatinib, bosutinib",0.559090917934782,0.18111458540599,FALSE
"H2009","Pearson.est","benzodiazepine receptor agonist",0.2133,0.544,0.963,515,0.982,"nefiracetam, lorazepam, CL.218872, zaleplon, indiplon, temazepam, eprinomectin",0.0163737128754655,0.00788851221305034,FALSE
"H2009","Pearson.est","bromodomain inhibitor",0.49086,1.23,0.228,207,0.634,"bromosporine",0.642065152999546,0.197910742118267,FALSE
"H2009","Pearson.est","calcium channel blocker",0.41574,1.06,0.389,156,0.694,"carboxyamidotriazole, mibefradil, pranidipine",0.410050398674292,0.158640529545145,FALSE
"H2009","Pearson.est","CC chemokine receptor antagonist",0.22137,0.568,0.961,1129,1,"SB.225002, UNBS.5162, PF.04136309, MK.0812, RS.504393, navarixin, ZK811752",0.0172766123314547,0,FALSE
"H2009","Pearson.est","CDK inhibitor",0.16,0.408,0.998,15,0.997,"abemaciclib",0.000869458712628891,0.00130484168834428,FALSE
"H2009","Pearson.est","CHK inhibitor",-0.44925,-1.11,0.327,979,0.67,"PF.477736, LY2606368, CHIR.124, LY2603618",0.485452247339714,0.173925197299174,FALSE
"H2009","Pearson.est","cyclooxygenase inhibitor",-0.40752,-0.995,0.445,1292,0.755,"ketoprofen, AM.404, phenazone, FK.3311, aspirin, ramifenazone",0.351639989019068,0.122053048370812,FALSE
"H2009","Pearson.est","cytochrome P450 inhibitor",0.7995,2.01,0,277,0.0619,"metyrapone, cobicistat, clotrimazole, itraconazole, eplerenone, morin",Inf,1.20830935097988,TRUE
"H2009","Pearson.est","DNA alkylating agent",0.31846,0.828,0.674,261,0.804,"carboplatin, TH.302, carmustine, temozolomide, streptozotocin, melphalan",0.17134010346468,0.0947439512515487,FALSE
"H2009","Pearson.est","DNA inhibitor",0.49624,1.3,0.186,261,0.636,"pibenzimol, carboplatin, chlorambucil, carmustine, oxaliplatin, metronidazole, melphalan",0.730487055782084,0.196542884351586,FALSE
"H2009","Pearson.est","DNA methyltransferase inhibitor",-0.4607,-1.13,0.309,1351,0.702,"azacitidine, SGI.1027, decitabine",0.510041520575165,0.153662887870195,FALSE
"H2009","Pearson.est","DNA polymerase inhibitor",-0.27401,-0.665,0.807,1397,0.941,"cephalomannine",0.0931264652779296,0.0264103765727431,FALSE
"H2009","Pearson.est","DNA synthesis inhibitor",0.34516,0.897,0.533,331,0.914,"altretamine, artesunate, nelarabine, azodicarbonamide, cyclocytidine",0.273272790973428,0.0390538042661686,FALSE
"H2009","Pearson.est","dopamine receptor antagonist",0.48243,1.21,0.267,324,0.593,"paliperidone, raclopride, nemonapride, isofloxythepin, amisulpride, remoxipride, domperidone",0.573488738635425,0.226945306635737,FALSE
"H2009","Pearson.est","estrogen receptor agonist",-0.24614,-0.609,0.904,1365,0.976,"ethinyl.estradiol",0.0438315695246367,0.0105501823333082,FALSE
"H2009","Pearson.est","estrogen receptor antagonist",0.21775,0.56,0.951,1134,0.998,"fulvestrant, danazol, toremifene, tamoxifen, raloxifene, clomifene",0.0218194830625861,0.000869458712628891,FALSE
"H2009","Pearson.est","FGFR inhibitor",0.52991,1.39,0.138,179,0.564,"erdafitinib, orantinib, dovitinib",0.860120913598763,0.248720896016658,FALSE
"H2009","Pearson.est","FLT3 inhibitor",0.33656,0.886,0.586,179,0.902,"TG.101348, GTP.14564, dovitinib",0.232102383981909,0.0447934624580583,FALSE
"H2009","Pearson.est","glucocorticoid receptor agonist",0.41901,1.09,0.363,279,0.706,"dexamethasone.acetate, piretanide, prednisolone.hemisuccinate, halcinonide, triamcinolone, fluticasone.propionate, deflazacort, flumethasone.pivalate",0.440093374963888,0.151195298948196,FALSE
"H2009","Pearson.est","glutamate receptor antagonist",0.32368,0.82,0.659,240,0.793,"MTPG, CPP, ACDPP",0.18111458540599,0.100726812682396,FALSE
"H2009","Pearson.est","glycogen synthase kinase inhibitor",0.33159,0.858,0.632,483,0.83,"CHIR.98014, GSK.3.inhibitor.IX, CHIR.99021, indirubin, TWS.119",0.199282921717615,0.0809219076239261,FALSE
"H2009","Pearson.est","growth factor receptor inhibitor",-0.59576,-1.45,0.103,1050,0.405,"lestaurtinib, GSK1838705A, danusertib, AZD3463",0.987162775294828,0.392544976785331,FALSE
"H2009","Pearson.est","HCV inhibitor",0.47552,1.22,0.234,117,0.613,"Ro.9187, mericitabine",0.630784142589857,0.212539525481585,FALSE
"H2009","Pearson.est","HDAC inhibitor",-0.5424,-1.34,0.155,1134,0.487,"givinostat, chidamide, AR.42, belinostat, tacedinaline, PCI.24781, SB.939, trichostatin.a, vorinostat, panobinostat, JNJ.26481585",0.809668301829709,0.312471038785366,FALSE
"H2009","Pearson.est","histamine receptor antagonist",-0.34167,-0.849,0.622,1284,0.844,"levocetirizine, terfenadine, ranitidine, ebastine, zolantidine",0.206209615309181,0.073657553374345,FALSE
"H2009","Pearson.est","HMGCR inhibitor",0.7293,1.82,0.0155,258,0.151,"mevastatin, fluvastatin, atorvastatin, pitavastatin",1.80966830182971,0.821023052706831,TRUE
"H2009","Pearson.est","HSP inhibitor",-0.6319,-1.58,0.0557,1002,0.307,"guanidine, SNX.2112, ganetespib, NVP.AUY922, SNX.5422, XL888, alvespimycin, PU.H71, KW.2478, tanespimycin, BIIB021, VER.49009",1.25414480482627,0.512861624522813,FALSE
"H2009","Pearson.est","JAK inhibitor",-0.45301,-1.12,0.318,1214,0.686,"AZD1480, WHI.P154, LY2784544, ruxolitinib, CEP.33779",0.497572880015567,0.163675884293248,FALSE
"H2009","Pearson.est","KIT inhibitor",0.25702,0.655,0.864,383,0.958,"pazopanib, cediranib, KI.8751, telatinib, motesanib, sunitinib",0.0634862575211067,0.0186344909214556,FALSE
"H2009","Pearson.est","MDM inhibitor",0.82381,2.12,0,97,0.0387,"idasanutlin, AMG.232, nutlin.3, CGM097",Inf,1.41228903498109,TRUE
"H2009","Pearson.est","MEK inhibitor",-0.37827,-0.9,0.538,913,0.812,"PD.0325901, PD.198306, AS.703026, refametinib, MEK1.2.inhibitor, trametinib, PD.184352, AZD8330, PD.98059, TAK.733, Ro.4987655",0.269217724333611,0.0904439707588247,FALSE
"H2009","Pearson.est","MET inhibitor",-0.71592,-1.74,0.0206,1361,0.189,"LY2801653, INC.280",1.68613277963085,0.723538195826756,TRUE
"H2009","Pearson.est","microtubule inhibitor",-0.28182,-0.683,0.825,939,0.969,"colchicine, cytochalasin.b, D.64131, podophyllotoxin, cabazitaxel",0.0835460514500749,0.0136762229492347,FALSE
"H2009","Pearson.est","mTOR inhibitor",-0.24386,-0.596,0.904,1158,0.963,"torin.2, deforolimus, everolimus, AZD8055, temsirolimus, GSK2126458, PF.05212384, sirolimus",0.0438315695246367,0.0163737128754655,FALSE
"H2009","Pearson.est","NFkB pathway inhibitor",0.47912,1.25,0.229,299,0.688,"tyloxapol, BAY.11.7082, betulinic.acid, parthenolide...., parthenolide",0.640164517660112,0.162411561764489,FALSE
"H2009","Pearson.est","opioid receptor agonist",0.33533,0.865,0.6,190,0.847,"cebranopadol, BW.180C",0.221848749616356,0.0721165896692931,FALSE
"H2009","Pearson.est","p38 MAPK inhibitor",-0.68503,-1.66,0.0265,1208,0.264,"CMPD.1, SB.242235, TAK.715, SB.239063, talmapimod",1.57675412606319,0.578396073130169,FALSE
"H2009","Pearson.est","PARP inhibitor",0.25625,0.665,0.857,1079,0.972,"AG.14361, endo.IWR.1, AZD2461, E7449, olaparib, niraparib, talazoparib, PJ.34",0.0670191780768018,0.0123337350737254,FALSE
"H2009","Pearson.est","PDGFR tyrosine kinase receptor inhibitor",0.3746,0.97,0.491,508,0.803,"pazopanib, orantinib, SU014813, dovitinib, linifanib, KI.8751, axitinib, telatinib, motesanib, sunitinib, ponatinib, CP.673451, regorafenib, lenvatinib",0.308918507877032,0.095284454721319,FALSE
"H2009","Pearson.est","phosphatase inhibitor",0.57569,1.45,0.0917,92,0.56,"GSK2830371, menadione, bis.maltolato.oxovanadium.IV.",1.03763066432998,0.2518119729938,FALSE
"H2009","Pearson.est","phosphodiesterase inhibitor",-0.29278,-0.72,0.8,1317,0.945,"EMD.53998, papaverine",0.0969100130080564,0.0245681914907371,FALSE
"H2009","Pearson.est","PI3K inhibitor",-0.27893,-0.679,0.823,1121,0.948,"PIK.75, CUDC.907, GDC.0941, GSK2126458, PF.05212384, PI.828, TG.100713, CH5132799, taselisib, alpelisib",0.0846001647877302,0.0231916626619338,FALSE
"H2009","Pearson.est","PLK inhibitor",-0.72235,-1.77,0.0288,1373,0.188,"HMN.214, BI.2536, NMS.1286937",1.54060751224077,0.72584215073632,TRUE
"H2009","Pearson.est","potassium channel blocker",0.3229,0.845,0.616,113,0.8,"mepivacaine",0.210419287835575,0.0969100130080564,FALSE
"H2009","Pearson.est","PPAR receptor agonist",0.66616,1.68,0.0393,104,0.22,"clofibrate, fenofibrate, GW.501516",1.40560744962457,0.657577319177794,TRUE
"H2009","Pearson.est","progesterone receptor agonist",0.40932,1.04,0.403,356,0.701,"norethindrone, norethindrone.acetate, norgestrel, tanaproget",0.39469495385889,0.154281982033341,FALSE
"H2009","Pearson.est","proteasome inhibitor",-0.29843,-0.735,0.784,1097,0.979,"ONX.0914, ixazomib, carfilzomib, delanzomib",0.105683937315562,0.00921730819686218,FALSE
"H2009","Pearson.est","protein synthesis inhibitor",-0.36018,-0.894,0.583,1074,0.796,"emetine, thiostrepton, bruceantin, tedizolid.phosphate, homoharringtonine, cycloheximide, puromycin",0.234331445240986,0.0990869322623309,FALSE
"H2009","Pearson.est","protein tyrosine kinase inhibitor",-0.81453,-1.97,0.00172,1321,0.0586,"tyrphostin.A9, NVP.TAE226, BMS.599626, CP.724714, AV.412",2.76447155309245,1.23210238398191,TRUE
"H2009","Pearson.est","RAF inhibitor",0.77208,2,0.00236,60,0.0449,"dabrafenib, vemurafenib, SB.590885, AZ.628, TAK.632",2.62708799702989,1.34775365899668,TRUE
"H2009","Pearson.est","RET tyrosine kinase inhibitor",-0.62262,-1.53,0.0694,1431,0.348,"vandetanib",1.15864052954514,0.458420756053419,FALSE
"H2009","Pearson.est","retinoid receptor agonist",-0.43973,-1.05,0.406,1186,0.751,"tamibarotene, CD.437, adarotene",0.391473966422806,0.124360062995832,FALSE
"H2009","Pearson.est","ribonucleotide reductase inhibitor",0.70612,1.79,0.0133,355,0.15,"cladribine, pentostatin, triapine, hydroxyurea, clofarabine, cytarabine, fludarabine",1.87614835903291,0.823908740944319,TRUE
"H2009","Pearson.est","serotonin receptor agonist",0.51619,1.36,0.137,544,0.57,"aripiprazole, NAN.190, zolmitriptan, SR.57227A, ipsapirone",0.863279432843593,0.244125144327509,FALSE
"H2009","Pearson.est","serotonin receptor antagonist",0.33329,0.881,0.572,161,0.879,"lerisetron, paliperidone, aripiprazole",0.242603971206976,0.0560111249262281,FALSE
"H2009","Pearson.est","sodium channel blocker",0.4611,1.2,0.266,321,0.577,"cibenzoline, benzethonium, butamben, mepivacaine, oxcarbazepine, quinidine, mexiletine",0.575118363368933,0.238824186844269,FALSE
"H2009","Pearson.est","src inhibitor",-0.75769,-1.84,0.00525,1408,0.149,"dasatinib, ZM.306416, bosutinib, saracatinib",2.27984069659404,0.826813731587726,TRUE
"H2009","Pearson.est","sterol demethylase inhibitor",-0.34066,-0.846,0.641,1385,0.823,"lanoconazole",0.193141970481183,0.0846001647877302,FALSE
"H2009","Pearson.est","TGF beta receptor inhibitor",-0.50408,-1.22,0.233,1166,0.6,"SB.431542, D.4476, repsox",0.632644078973981,0.221848749616356,FALSE
"H2009","Pearson.est","thymidylate synthase inhibitor",0.27182,0.704,0.806,398,0.947,"ftorafur, doxifluridine, trifluridine",0.0936649581949093,0.0236500209967266,FALSE
"H2009","Pearson.est","topoisomerase inhibitor",-0.29219,-0.728,0.773,1006,0.961,"rubitecan, licochalcone.a, fleroxacin, mitoxantrone, irinotecan, amonafide, SN.38, genz.644282, camptothecin, exatecan.mesylate",0.111820506081675,0.0172766123314547,FALSE
