"type","Rank_metric","Drug_set","ES","NES","p_value","Position_at_max","FDR_q_value","Leading_edge","minusLogP","minusLogFDR","sig"
"H520","Pearson.est","protein tyrosine kinase inhibitor",-0.34542,-0.895,0.583,1376,0.995,"CP.724714, rheochrysidin",0.234331445240986,0.00217691925427455,FALSE
"H520","Pearson.est","RAF inhibitor",0.47834,1.23,0.232,336,0.945,"SB.590885, vemurafenib, sorafenib, LGX818, dabrafenib, AZ.628",0.6345120151091,0.0245681914907371,FALSE
"H520","Pearson.est","RET tyrosine kinase inhibitor",-0.3001,-0.765,0.734,1355,0.964,"sunitinib",0.134303940083929,0.0159229660971692,FALSE
"H520","Pearson.est","retinoid receptor agonist",0.42832,1.1,0.337,27,1,"LE.135",0.472370099128661,0,FALSE
"H520","Pearson.est","ribonucleotide reductase inhibitor",-0.43338,-1.09,0.35,1441,0.937,"pentostatin",0.455931955649724,0.0282604091122217,FALSE
"H520","Pearson.est","serotonin receptor agonist",-0.70693,-1.83,0.0154,1246,0.135,"NAN.190, zolmitriptan, ipsapirone, aripiprazole",1.81247927916354,0.869666231504994,TRUE
"H520","Pearson.est","serotonin receptor antagonist",-0.42174,-1.1,0.359,1390,0.967,"lurasidone, aripiprazole",0.444905551421681,0.0145735259169983,FALSE
"H520","Pearson.est","sodium channel blocker",0.33502,0.868,0.617,453,0.925,"brivaracetam, ajmaline, mepivacaine, butamben, cibenzoline, mexiletine",0.209714835966758,0.0338582672609674,FALSE
"H520","Pearson.est","src inhibitor",-0.31848,-0.813,0.688,1036,0.994,"bosutinib, PP.1, PP.2, masitinib",0.162411561764489,0.00261361560268669,FALSE
"H520","Pearson.est","sterol demethylase inhibitor",-0.33923,-0.89,0.557,1163,0.969,"sulconazole, posaconazole, ketoconazole",0.254144804826271,0.0136762229492347,FALSE
"H520","Pearson.est","TGF beta receptor inhibitor",-0.5623,-1.45,0.105,931,0.621,"repsox, adaprev, SB.431542, D.4476, SB.525334",0.978810700930062,0.20690839982342,FALSE
"H520","Pearson.est","thymidylate synthase inhibitor",-0.33218,-0.874,0.593,479,0.904,"ftorafur, doxifluridine, raltitrexed, carmofur, capecitabine, trifluridine",0.226945306635737,0.0438315695246367,FALSE
"H520","Pearson.est","topoisomerase inhibitor",0.31477,0.816,0.668,564,0.853,"mitoxantrone, doxorubicin, idarubicin, exatecan.mesylate, amsacrine, rubitecan, epirubicin, etoposide, voreloxin, daunorubicin, teniposide, camptothecin, valrubicin, genz.644282, licochalcone.a",0.175223537524454,0.069050968832477,FALSE
"H520","Pearson.est","tubulin polymerization inhibitor",0.29879,0.773,0.705,393,0.789,"mebendazole, epothilone.b, oxibendazole, BNC105, CYT.997, vinorelbine, fenbendazole, verubulin, taltobulin, indibulin",0.151810883008601,0.10292299679058,FALSE
"H520","Pearson.est","tyrosine kinase inhibitor",0.25607,0.669,0.848,510,0.875,"dasatinib, AV.412, bafetinib, NVP.TAE226, sorafenib, mubritinib, tyrphostin.A9, vandetanib, tivantinib, apatinib, PP.121, regorafenib, hypericin",0.0716041477432862,0.0579919469776868,FALSE
"H520","Pearson.est","VEGFR inhibitor",0.19396,0.516,0.975,118,0.972,"BMS.690514, XL.647, OSI.930, SAR131675",0.0109953843014632,0.0123337350737254,FALSE
"H520","Pearson.est","vitamin D receptor agonist",0.5113,1.31,0.173,338,0.939,"ercalcitriol, calcitriol, maxacalcitol",0.761953896871205,0.0273344077338891,FALSE
"HCC15","Pearson.est","EGFR inhibitor",0.4747,1.21,0.243,371,0.981,"CUDC.101, ARRY.334543, BMS.690514, tyrphostin.AG.1478, erlotinib, XL.647, canertinib, WZ.3146, brigatinib, AST.1306, BIBU.1361, gefitinib, PD.168393, icotinib, lapatinib, afatinib, osimertinib, rociletinib, pelitinib, BIBX.1382, AZD8931",0.614393726401688,0.0083309926200515,FALSE
"HCC15","Pearson.est","Abl kinase inhibitor",0.36733,0.926,0.519,185,0.874,"dasatinib, metatinib, bafetinib",0.284832642151542,0.058488567365597,FALSE
"HCC15","Pearson.est","acetylcholine receptor agonist",0.27619,0.706,0.796,498,0.873,"xanomeline, oxiracetam, tremorine",0.0990869322623309,0.0589857562944303,FALSE
"HCC15","Pearson.est","acetylcholine receptor antagonist",-0.75094,-1.99,0.00233,1279,0.118,"dicycloverine, methscopolamine, iododexetimide",2.63264407897398,0.928117992693875,TRUE
"HCC15","Pearson.est","adenosine receptor antagonist",0.4539,1.16,0.271,111,0.966,"theophylline, PSB.1115",0.567030709125594,0.0150228735845067,FALSE
"HCC15","Pearson.est","adrenergic receptor agonist",-0.37441,-0.992,0.426,1230,0.943,"ritodrine, methyldopa, norepinephrine, isoetharine",0.370590400897281,0.0254883072626717,FALSE
"HCC15","Pearson.est","adrenergic receptor antagonist",0.36834,0.93,0.531,170,0.9,"practolol, idazoxan, propranolol, vincamine",0.274905478918531,0.0457574905606751,FALSE
"HCC15","Pearson.est","AKT inhibitor",0.38861,0.992,0.446,446,0.956,"MK.2206, triciribine, palomid.529, AT7867, ONC201",0.350665141287858,0.0195421077238999,FALSE
"HCC15","Pearson.est","ALK tyrosine kinase receptor inhibitor",-0.24648,-0.634,0.881,1193,0.966,"alectinib, CEP.37440, DMH1",0.0550240915879521,0.0150228735845067,FALSE
"HCC15","Pearson.est","androgen receptor antagonist",-0.72362,-1.96,0.0121,1184,0.0767,"flutamide, nilutamide, enzalutamide, cyproterone.acetate",1.91721462968355,1.11520463605102,TRUE
"HCC15","Pearson.est","antioxidant",-0.57035,-1.49,0.0938,1132,0.466,"benfotiamine, trolox",1.02779716162094,0.33161408331,FALSE
"HCC15","Pearson.est","AP inhibitor",0.62917,1.57,0.0485,82,0.617,"birinapant, GDC.0152",1.31425826139774,0.209714835966758,FALSE
"HCC15","Pearson.est","ATPase inhibitor",0.39911,1.02,0.417,279,0.935,"k.strophanthidin, oligomycin.a, evodiamine, ouabain, blebbistatin....",0.379863945026242,0.0291883891274822,FALSE
"HCC15","Pearson.est","Aurora kinase inhibitor",0.40262,1.03,0.41,421,0.959,"alisertib, MK.8745, MK.5108, barasertib.HQPA, ENMD.2076, barasertib, ZM.447439, PF.03814735, danusertib, CCT137690, SNS.314",0.387216143280265,0.0181813928293364,FALSE
"HCC15","Pearson.est","bacterial 50S ribosomal subunit inhibitor",0.30022,0.744,0.777,161,0.912,"tedizolid, azithromycin",0.109578981199086,0.0400051616715838,FALSE
"HCC15","Pearson.est","bacterial DNA gyrase inhibitor",0.32057,0.81,0.665,434,0.884,"lomefloxacin, novobiocin, finafloxacin, trovafloxacin",0.177178354696895,0.0535477349869269,FALSE
"HCC15","Pearson.est","BCL inhibitor",-0.35061,-0.95,0.468,1382,0.856,"gossypol, ABT.737",0.329754146925876,0.0675262353228468,FALSE
"HCC15","Pearson.est","Bcr.Abl kinase inhibitor",0.41978,1.07,0.346,185,1,"dasatinib, metatinib, bafetinib",0.460923901207223,0,FALSE
"HCC15","Pearson.est","benzodiazepine receptor agonist",0.41034,1.04,0.377,146,1,"gamma.aminobutyric.acid, ivermectin, ZK.93423, bentazepam",0.423658649794207,0,FALSE
"HCC15","Pearson.est","bromodomain inhibitor",-0.382,-0.998,0.461,1149,1,"I.BET151, PFI.1",0.336299074610352,0,FALSE
"HCC15","Pearson.est","calcium channel blocker",-0.3376,-0.897,0.536,1244,0.896,"efonidipine.monoethanolate, SR.33805, mibefradil",0.27083521030723,0.0476919903378748,FALSE
"HCC15","Pearson.est","CC chemokine receptor antagonist",0.31191,0.812,0.701,470,0.908,"UNBS.5162, MK.0812, ZK811752, RS.504393",0.154281982033341,0.0419141514789149,FALSE
"HCC15","Pearson.est","CDK inhibitor",0.18167,0.459,0.995,475,0.989,"alvocidib, NU6027, kenpaullone, P276.00, AT.7519, aminopurvalanol.a, CR8..R., dinaciclib",0.00217691925427455,0.0048037084028206,FALSE
"HCC15","Pearson.est","CHK inhibitor",-0.41944,-1.1,0.32,1169,0.983,"AZD7762, SCH.900776, SB.218078",0.494850021680094,0.00744648216786438,FALSE
"HCC15","Pearson.est","cyclooxygenase inhibitor",-0.36877,-0.976,0.453,1212,0.928,"acetylsalicylsalicylic.acid, FR.122047, piroxicam, AM.404, tryptanthrin, naproxen",0.343901797987168,0.0324520237811379,FALSE
"HCC15","Pearson.est","cytochrome P450 inhibitor",0.55354,1.39,0.117,243,0.803,"PF.4981517, morin, eplerenone",0.931814138253838,0.095284454721319,FALSE
"HCC15","Pearson.est","DNA alkylating agent",-0.25436,-0.679,0.845,1150,0.938,"streptozotocin, satraplatin, cyclophosphamide, temozolomide",0.0731432910503077,0.0277971616209356,FALSE
"HCC15","Pearson.est","DNA inhibitor",-0.23693,-0.627,0.891,1344,0.948,"pibenzimol, nithiamide",0.0501222959631252,0.0231916626619338,FALSE
"HCC15","Pearson.est","DNA methyltransferase inhibitor",0.69931,1.76,0.017,357,0.742,"azacitidine, SGI.1027, decitabine, fdcyd",1.76955107862173,0.129596094720973,FALSE
"HCC15","Pearson.est","DNA polymerase inhibitor",0.46272,1.16,0.282,212,0.966,"foscarnet, cephalomannine, idoxuridine, cidofovir",0.549750891680639,0.0150228735845067,FALSE
"HCC15","Pearson.est","DNA synthesis inhibitor",-0.35604,-0.929,0.5,1415,0.864,"altretamine, enocitabine",0.301029995663981,0.0634862575211067,FALSE
"HCC15","Pearson.est","dopamine receptor antagonist",-0.3643,-0.959,0.486,1029,0.877,"nemonapride, clebopride, mesoridazine, ziprasidone, paliperidone, remoxipride, amisulpride, lurasidone",0.313363730737707,0.0570004066339595,FALSE
"HCC15","Pearson.est","estrogen receptor agonist",-0.29956,-0.801,0.704,1268,0.889,"estrone, erteberel",0.152427340857888,0.0510982390297863,FALSE
"HCC15","Pearson.est","estrogen receptor antagonist",-0.79436,-2.06,0.00483,1292,0.13,"danazol, raloxifene, fulvestrant, tamoxifen",2.31605286924849,0.886056647693163,TRUE
"HCC15","Pearson.est","FGFR inhibitor",-0.31224,-0.832,0.636,449,0.925,"orantinib, regorafenib, erdafitinib, AZD4547, PD.173074, dovitinib, nintedanib, MK.2461, lucitanib, lenvatinib",0.196542884351586,0.0338582672609674,FALSE
"HCC15","Pearson.est","FLT3 inhibitor",-0.31852,-0.846,0.62,1151,0.932,"KW.2449, pacritinib, TG.101348, quizartinib, TG.02, lestaurtinib, sunitinib",0.207608310501746,0.0305840876460186,FALSE
"HCC15","Pearson.est","glucocorticoid receptor agonist",-0.40605,-1.06,0.368,1017,1,"flumethasone, halcinonide, triamcinolone, desonide, rimexolone, prednisolone, triamcinolone.acetonide, prednisolone.acetate, beclomethasone.dipropionate, fluticasone.propionate, fluocinolone.acetonide, piretanide, dexamethasone.acetate, flumethasone.pivalate, hydrocortisone",0.434152181326482,0,FALSE
"HCC15","Pearson.est","glutamate receptor antagonist",0.31265,0.789,0.703,256,0.867,"ACDPP, tiletamine, kynurenic.acid",0.153044674980176,0.0619809025237897,FALSE
"HCC15","Pearson.est","glycogen synthase kinase inhibitor",0.38542,0.975,0.478,23,0.951,"CHIR.99021",0.320572103387881,0.0218194830625861,FALSE
"HCC15","Pearson.est","growth factor receptor inhibitor",-0.50199,-1.32,0.18,1353,0.737,"GW.441756, lestaurtinib",0.744727494896694,0.132532512140949,FALSE
"HCC15","Pearson.est","HCV inhibitor",0.35214,0.905,0.568,64,0.884,"daclatasvir",0.245651664288981,0.0535477349869269,FALSE
"HCC15","Pearson.est","HDAC inhibitor",0.51723,1.31,0.164,448,0.852,"chidamide, nexturastat.a, panobinostat, belinostat, SB.939, NSC.3852, scriptaid, entinostat, M.344, ACY.1215, resminostat, givinostat, trichostatin.a, mocetinostat, dacinostat, romidepsin",0.785156151952302,0.0695604052332999,FALSE
"HCC15","Pearson.est","histamine receptor antagonist",-0.20707,-0.558,0.945,963,0.977,"lafutidine, ICI.162846, tiotidine, cyproheptadine, terfenadine, ebastine, ranitidine, BF2.649, epinastine",0.0245681914907371,0.0101054362812269,FALSE
"HCC15","Pearson.est","HMGCR inhibitor",0.37717,0.944,0.519,211,0.941,"atorvastatin, simvastatin",0.284832642151542,0.0264103765727431,FALSE
"HCC15","Pearson.est","HSP inhibitor",0.59866,1.51,0.0688,195,0.665,"BIIB021, NMS.E973, PU.H71, SNX.2112, NVP.AUY922, SNX.5422, ganetespib",1.16241156176449,0.177178354696895,FALSE
"HCC15","Pearson.est","JAK inhibitor",-0.33546,-0.872,0.577,1165,0.914,"pacritinib, TG.101348, CEP.33779, AZD1480, filgotinib, TG.02, lestaurtinib",0.238824186844269,0.0390538042661686,FALSE
"HCC15","Pearson.est","KIT inhibitor",0.28591,0.72,0.825,104,0.878,"midostaurin, OSI.930, dasatinib",0.0835460514500749,0.0565054840938974,FALSE
"HCC15","Pearson.est","MDM inhibitor",-0.28225,-0.76,0.708,407,0.873,"serdemetan, AMG.232, idasanutlin, nutlin.3, CGM097, RITA",0.149966742310231,0.0589857562944303,FALSE
"HCC15","Pearson.est","MEK inhibitor",-0.26987,-0.721,0.764,1114,0.906,"PD.318088, nobiletin, refametinib, MEK162, BIX.02188, arctigenin",0.11690664142431,0.0428718023231869,FALSE
"HCC15","Pearson.est","MET inhibitor",-0.57646,-1.55,0.0798,1135,0.497,"INC.280, PHA.665752, NVP.BVU972, AMG458",1.09799710864927,0.303643611266668,FALSE
"HCC15","Pearson.est","microtubule inhibitor",0.40806,1.03,0.42,519,0.959,"estramustine.phosphate, triclabendazole, D.64131, cabazitaxel, podophyllotoxin",0.3767507096021,0.0181813928293364,FALSE
"HCC15","Pearson.est","mTOR inhibitor",0.64849,1.62,0.0462,393,0.949,"deforolimus, PI.103, AZD8055, everolimus, PKI.179, NVP.BEZ235, temsirolimus, LY3023414, torin.1, torin.2, MLN0128, AZD2014, PP242, GDC.0980, WYE.125132, sirolimus, palomid.529, voxtalisib, PF.04691502, SB.2343",1.33535802444387,0.0227337875727074,FALSE
"HCC15","Pearson.est","NFkB pathway inhibitor",-0.37119,-0.972,0.453,1046,0.891,"IKK.2.inhibitor.V, curcumin, tyloxapol, Ro.106.9920, bindarit, parthenolide, betulinic.acid",0.343901797987168,0.0501222959631252,FALSE
"HCC15","Pearson.est","opioid receptor agonist",-0.40723,-1.1,0.328,1285,0.983,"ADL5859, salvinorin.a",0.484126156288321,0.00744648216786438,FALSE
"HCC15","Pearson.est","p38 MAPK inhibitor",-0.188,-0.508,0.983,898,0.978,"SB.242235, talmapimod, CMPD.1, TAK.715, skepinone.l",0.00744648216786438,0.00966114521239857,FALSE
"HCC15","Pearson.est","PARP inhibitor",-0.57564,-1.52,0.0745,987,0.476,"olaparib, niraparib, AZD2461, AG.14361, talazoparib",1.12784372725171,0.322393047279507,FALSE
"HCC15","Pearson.est","PDGFR tyrosine kinase receptor inhibitor",-0.29684,-0.792,0.7,1118,0.874,"imatinib, axitinib, lenvatinib, vatalanib, telatinib, CP.673451, sunitinib, masitinib",0.154901959985743,0.058488567365597,FALSE
"HCC15","Pearson.est","phosphatase inhibitor",-0.29889,-0.785,0.718,1166,0.86,"CID.5458317, menadione, alexidine",0.1438755557577,0.0655015487564323,FALSE
"HCC15","Pearson.est","phosphodiesterase inhibitor",0.28622,0.726,0.808,290,0.892,"papaverine, enoximone, EMD.53998",0.0925886392254138,0.0496351456238769,FALSE
"HCC15","Pearson.est","PI3K inhibitor",0.35301,0.881,0.597,393,0.87,"PI.103, PKI.179, NVP.BEZ235, BGT226, LY3023414, GDC.0980, buparlisib, ZSTK.474, voxtalisib, PF.04691502, SB.2343",0.224025668870631,0.0604807473813815,FALSE
"HCC15","Pearson.est","PLK inhibitor",0.52789,1.33,0.158,557,0.891,"HMN.214, BI.2536, volasertib",0.801342913045577,0.0501222959631252,FALSE
"HCC15","Pearson.est","potassium channel blocker",0.64186,1.6,0.0488,370,0.706,"ML133, ibutilide, mepivacaine, oleoylethanolamide, dofetilide",1.31158017799729,0.151195298948196,FALSE
"HCC15","Pearson.est","PPAR receptor agonist",-0.38262,-1.01,0.432,1134,1,"S26948, clofibrate, fenofibrate",0.364516253185088,0,FALSE
"HCC15","Pearson.est","progesterone receptor agonist",-0.74274,-1.98,0.00495,1220,0.0861,"melengestrol.acetate, dienogest, nomegestrol.acetate, norgestrel, danazol, norethindrone.acetate",2.30539480106643,1.06499684854635,TRUE
"HCC15","Pearson.est","proteasome inhibitor",0.43655,1.1,0.326,455,1,"ONX.0914, MG.132, carfilzomib, delanzomib",0.486782399932061,0,FALSE
"HCC15","Pearson.est","protein synthesis inhibitor",0.23232,0.601,0.919,268,0.965,"clofoctol, cycloheximide, puromycin, thiostrepton",0.0366844886138887,0.0154726866562074,FALSE
"HCC15","Pearson.est","protein tyrosine kinase inhibitor",0.33983,0.854,0.624,341,0.889,"AV.412, NVP.TAE226, mubritinib, tyrphostin.A9",0.204815410317576,0.0510982390297863,FALSE
"HCC15","Pearson.est","RAF inhibitor",0.48008,1.21,0.264,364,0.981,"SB.590885, vemurafenib, sorafenib, LGX818, dabrafenib, AZ.628",0.578396073130169,0.0083309926200515,FALSE
"HCC15","Pearson.est","RET tyrosine kinase inhibitor",-0.30204,-0.811,0.676,1393,0.933,"sunitinib",0.170053304058364,0.0301183562535,FALSE
"HCC15","Pearson.est","retinoid receptor agonist",0.29303,0.735,0.79,67,0.902,"LE.135",0.102372908709559,0.0447934624580583,FALSE
"HCC15","Pearson.est","ribonucleotide reductase inhibitor",-0.36771,-0.992,0.4,1441,0.943,"pentostatin",0.397940008672038,0.0254883072626717,FALSE
"HCC15","Pearson.est","serotonin receptor agonist",-0.67185,-1.78,0.0221,1211,0.203,"NAN.190, zolmitriptan, ipsapirone, aripiprazole",1.65560772631489,0.692503962086787,TRUE
"HCC15","Pearson.est","serotonin receptor antagonist",-0.42442,-1.16,0.249,1390,0.981,"lurasidone, aripiprazole",0.603800652904264,0.0083309926200515,FALSE
"HCC15","Pearson.est","sodium channel blocker",0.34602,0.881,0.603,463,0.87,"brivaracetam, ajmaline, mepivacaine, butamben, mexiletine, cibenzoline",0.219682687859849,0.0604807473813815,FALSE
"HCC15","Pearson.est","src inhibitor",-0.31149,-0.81,0.714,1283,0.902,"PP.2, masitinib",0.146301788223826,0.0447934624580583,FALSE
"HCC15","Pearson.est","sterol demethylase inhibitor",0.37449,0.958,0.496,10,0.948,"chlormidazole",0.304518323509803,0.0231916626619338,FALSE
"HCC15","Pearson.est","TGF beta receptor inhibitor",-0.47619,-1.27,0.198,1048,0.772,"D.4476, SB.431542, adaprev, SB.525334",0.703334809738469,0.112382699664264,FALSE
"HCC15","Pearson.est","thymidylate synthase inhibitor",0.37034,0.938,0.518,733,0.917,"ftorafur, raltitrexed, doxifluridine, capecitabine, carmofur",0.285670240254767,0.0376306643299789,FALSE
"HCC15","Pearson.est","topoisomerase inhibitor",0.32297,0.813,0.703,524,0.934,"mitoxantrone, idarubicin, exatecan.mesylate, doxorubicin, amsacrine, rubitecan, voreloxin, etoposide, camptothecin, teniposide, daunorubicin, genz.644282, valrubicin",0.153044674980176,0.0296531237699066,FALSE
"HCC15","Pearson.est","tubulin polymerization inhibitor",0.41064,1.04,0.403,592,1,"epothilone.b, mebendazole, BNC105, oxibendazole, CYT.997, vinorelbine, fenbendazole, taltobulin, verubulin, indibulin, plinabulin, parbendazole, KX2.391, dolastatin.10, podophyllotoxin, combretastatin.A.4, paclitaxel, vindesine",0.39469495385889,0,FALSE
"HCC15","Pearson.est","tyrosine kinase inhibitor",0.31143,0.79,0.708,586,0.891,"dasatinib, AV.412, NVP.TAE226, bafetinib, mubritinib, sorafenib, tyrphostin.A9, tivantinib, aminopurvalanol.a, apatinib, vandetanib, regorafenib, hypericin, GTP.14564, PP.121, tyrphostin.AG.99",0.149966742310231,0.0501222959631252,FALSE
"HCC15","Pearson.est","VEGFR inhibitor",0.21315,0.54,0.952,129,0.984,"BMS.690514, OSI.930, XL.647, SAR131675",0.0213630516155257,0.00700490156865849,FALSE
"HCC15","Pearson.est","vitamin D receptor agonist",0.55408,1.45,0.089,590,0.726,"ercalcitriol, calcitriol, maxacalcitol, tacalcitol, doxercalciferol",1.05060999335509,0.139063379299906,FALSE
"H460","Pearson.est","EGFR inhibitor",0.3822,0.992,0.443,362,0.889,"CUDC.101, ARRY.334543, tyrphostin.AG.1478, BMS.690514, erlotinib, WZ.3146, XL.647, canertinib, brigatinib, gefitinib, AST.1306, PD.168393, BIBU.1361, icotinib, BIBX.1382, afatinib, pelitinib, lapatinib, AZD8931",0.35359627377693,0.0510982390297863,FALSE
"H460","Pearson.est","Abl kinase inhibitor",0.27114,0.713,0.786,199,0.938,"dasatinib, metatinib, bafetinib",0.104577453960592,0.0277971616209356,FALSE
"H460","Pearson.est","acetylcholine receptor agonist",-0.24119,-0.625,0.898,1140,0.976,"pilocarpine, nicotine",0.0467236633326956,0.0105501823333082,FALSE
"H460","Pearson.est","acetylcholine receptor antagonist",-0.74252,-1.93,0.00575,1329,0.105,"dicycloverine, iododexetimide, methscopolamine",2.24033215531037,0.978810700930062,TRUE
"H460","Pearson.est","adenosine receptor antagonist",-0.38,-0.969,0.455,1218,0.888,"sulmazole, istradefylline",0.341988603342888,0.051587034221399,FALSE
"H460","Pearson.est","adrenergic receptor agonist",-0.40242,-1.03,0.414,1041,1,"midodrine, xylazine, oxymetazoline, ritodrine, methyldopa, norepinephrine, isoetharine",0.382999658879101,0,FALSE
"H460","Pearson.est","adrenergic receptor antagonist",0.35206,0.91,0.554,165,0.877,"practolol, propranolol, idazoxan, vincamine",0.25649023527157,0.0570004066339595,FALSE
"H460","Pearson.est","AKT inhibitor",0.36416,0.961,0.484,493,0.858,"MK.2206, triciribine, ONC201, GSK2110183, palomid.529, AT7867",0.315154638355588,0.0665127121512946,FALSE
"H460","Pearson.est","ALK tyrosine kinase receptor inhibitor",-0.38897,-1.01,0.426,1236,0.909,"alectinib, CEP.37440, DMH1",0.370590400897281,0.0414361167780325,FALSE
"H460","Pearson.est","androgen receptor antagonist",-0.71618,-1.89,0.00816,1044,0.111,"bicalutamide, nilutamide, flutamide, enzalutamide, cyproterone.acetate",2.08830984124614,0.954677021213343,TRUE
"H460","Pearson.est","antioxidant",-0.62435,-1.61,0.066,1170,0.373,"benfotiamine, trolox",1.18045606445813,0.428291168191312,FALSE
"H460","Pearson.est","AP inhibitor",0.64981,1.68,0.0414,62,0.656,"birinapant, GDC.0152",1.3829996588791,0.18309616062434,FALSE
"H460","Pearson.est","ATPase inhibitor",0.41178,1.1,0.321,411,1,"k.strophanthidin, oligomycin.a, ouabain, blebbistatin...., evodiamine, NMS.873, thonzonium",0.493494967595128,0,FALSE
"H460","Pearson.est","Aurora kinase inhibitor",0.23861,0.633,0.888,506,0.945,"MK.5108, barasertib, MK.8745, barasertib.HQPA, alisertib, MLN.8054, ENMD.2076, ZM.447439, PF.03814735, CCT137690",0.051587034221399,0.0245681914907371,FALSE
"H460","Pearson.est","bacterial 50S ribosomal subunit inhibitor",-0.40025,-1.04,0.393,1332,1,"azalomycin.b, dirithromycin",0.405607449624573,0,FALSE
"H460","Pearson.est","bacterial DNA gyrase inhibitor",0.4241,1.11,0.326,322,1,"lomefloxacin, finafloxacin, novobiocin, trovafloxacin",0.486782399932061,0,FALSE
"H460","Pearson.est","BCL inhibitor",-0.37063,-0.945,0.489,1401,0.844,"gossypol, ABT.737",0.31069114087638,0.073657553374345,FALSE
"H460","Pearson.est","Bcr.Abl kinase inhibitor",0.33168,0.887,0.557,199,0.845,"dasatinib, metatinib, bafetinib",0.254144804826271,0.0731432910503077,FALSE
"H460","Pearson.est","benzodiazepine receptor agonist",0.41886,1.11,0.337,108,1,"gamma.aminobutyric.acid, ivermectin, bentazepam, ZK.93423",0.472370099128661,0,FALSE
"H460","Pearson.est","bromodomain inhibitor",-0.58354,-1.52,0.0974,1038,0.394,"bromosporine, JQ1...., I.BET151, PFI.1",1.01144104312138,0.404503778174426,FALSE
"H460","Pearson.est","calcium channel blocker",-0.36745,-0.949,0.498,1201,0.866,"efonidipine.monoethanolate, SR.33805, mibefradil",0.302770657240282,0.0624821079826534,FALSE
"H460","Pearson.est","CC chemokine receptor antagonist",-0.26585,-0.683,0.838,1016,0.972,"navarixin, SB.225002, PF.04136309",0.0767559813697235,0.0123337350737254,FALSE
"H460","Pearson.est","CDK inhibitor",-0.33156,-0.827,0.654,1078,0.885,"indirubin, AZD5438, abemaciclib, R547, ribociclib, BMS.265246, TG.02, JNJ.7706621",0.184422251675733,0.0530567293021746,FALSE
"H460","Pearson.est","CHK inhibitor",-0.44864,-1.18,0.254,1034,1,"SCH.900776, AZD7762, SB.218078",0.595166283380062,0,FALSE
"H460","Pearson.est","cyclooxygenase inhibitor",-0.3727,-0.943,0.503,1183,0.794,"AM.404, acetylsalicylsalicylic.acid, tryptanthrin, FR.122047, piroxicam, naproxen",0.298432014944073,0.100179497572904,FALSE
"H460","Pearson.est","cytochrome P450 inhibitor",0.57781,1.53,0.0799,252,0.676,"PF.4981517, morin, eplerenone",1.09745322068601,0.170053304058364,FALSE
"H460","Pearson.est","DNA alkylating agent",-0.34785,-0.897,0.554,990,0.783,"mitomycin.c, carmustine, streptozotocin, melphalan, TH.302, satraplatin, cyclophosphamide, temozolomide",0.25649023527157,0.106238237942057,FALSE
"H460","Pearson.est","DNA inhibitor",-0.24333,-0.615,0.895,1366,0.965,"nithiamide, pibenzimol",0.048176964684088,0.0154726866562074,FALSE
"H460","Pearson.est","DNA methyltransferase inhibitor",0.54914,1.41,0.101,554,0.717,"azacitidine, decitabine, SGI.1027, fdcyd",0.995678626217357,0.1444808443322,FALSE
"H460","Pearson.est","DNA polymerase inhibitor",0.35889,0.927,0.526,129,0.883,"foscarnet, cephalomannine, cidofovir",0.279014255846261,0.0540392964224314,FALSE
"H460","Pearson.est","DNA synthesis inhibitor",-0.18947,-0.482,0.983,1420,0.984,"enocitabine",0.00744648216786438,0.00700490156865849,FALSE
"H460","Pearson.est","dopamine receptor antagonist",-0.36938,-0.94,0.5,1120,0.775,"mesoridazine, ziprasidone, remoxipride, paliperidone, amisulpride, lurasidone",0.301029995663981,0.11069829749369,FALSE
"H460","Pearson.est","estrogen receptor agonist",-0.39754,-1.02,0.418,1088,1,"ethinyl.estradiol, estrone, erteberel",0.378823718224965,0,FALSE
"H460","Pearson.est","estrogen receptor antagonist",-0.83998,-2.19,0.00355,1259,0.0213,"danazol, raloxifene, fulvestrant, tamoxifen",2.44977164694491,1.67162039656126,TRUE
"H460","Pearson.est","FGFR inhibitor",-0.4142,-1.04,0.369,1048,1,"nintedanib, MK.2461, lenvatinib, lucitanib",0.43297363384094,0,FALSE
"H460","Pearson.est","FLT3 inhibitor",-0.40395,-1.02,0.417,1172,1,"quizartinib, TG.101348, KW.2449, pacritinib, TG.02, sunitinib, lestaurtinib",0.379863945026242,0,FALSE
"H460","Pearson.est","glucocorticoid receptor agonist",-0.39015,-0.986,0.448,867,0.923,"triamcinolone.acetonide, fluorometholone, desonide, clobetasol.propionate, halcinonide, halobetasol.propionate, fludroxycortide, triamcinolone, rimexolone, flumethasone, prednisolone.acetate, prednisolone, beclomethasone.dipropionate, fluocinolone.acetonide, fluticasone.propionate, piretanide, hydrocortisone, flumethasone.pivalate, dexamethasone.acetate",0.348721986001856,0.0347982989740879,FALSE
"H460","Pearson.est","glutamate receptor antagonist",0.31904,0.836,0.626,194,0.803,"ACDPP, kynurenic.acid, tiletamine",0.20342566678957,0.095284454721319,FALSE
"H460","Pearson.est","glycogen synthase kinase inhibitor",0.36918,0.965,0.49,42,0.898,"CHIR.99021",0.309803919971486,0.0467236633326956,FALSE
"H460","Pearson.est","growth factor receptor inhibitor",-0.67217,-1.73,0.025,1267,0.231,"GSK1838705A, GW.441756, lestaurtinib",1.60205999132796,0.636388020107856,TRUE
"H460","Pearson.est","HCV inhibitor",0.38326,1.02,0.418,61,1,"daclatasvir",0.378823718224965,0,FALSE
"H460","Pearson.est","HDAC inhibitor",0.45107,1.19,0.261,169,1,"nexturastat.a, chidamide, panobinostat, belinostat, NSC.3852, scriptaid, SB.939, ACY.1215",0.583359492661719,0,FALSE
